recipe_name,ingredients,url,nutrition,salt_score,sweet_score,bitter_score,umami_score,richness_score
The Best Banana Bread,"1 cup white sugar, ½ cup margarine, softened, 2  eggs, 1 ½ cups mashed banana, 2 cups all-purpose flour, 1 teaspoon baking soda",https://www.allrecipes.com/recipe/16952/the-best-banana-bread/,"Total Fat 7g 9%, Saturated Fat 1g 7%, Cholesterol 25mg 8%, Sodium 175mg 8%, Total Carbohydrate 31g 11%, Dietary Fiber 1g 4%, Total Sugars 16g, Protein 3g, Vitamin C 2mg 10%, Calcium 9mg 1%, Iron 1mg 6%, Potassium 111mg 2%",6.622420410423976,5.359732240487902,5.7410514907782355,3.297249317540458,4.427421727879709
Spinach and Banana Power Smoothie,"1 cup plain soy milk, ¾ cup packed fresh spinach leaves, 1 large banana, sliced",https://www.allrecipes.com/recipe/241019/spinach-and-banana-power-smoothie/,"Total Fat 5g 6%, Saturated Fat 1g 4%, Sodium 143mg 6%, Total Carbohydrate 47g 17%, Dietary Fiber 6g 20%, Total Sugars 26g, Protein 10g, Vitamin C 18mg 91%, Calcium 90mg 7%, Iron 3mg 14%, Potassium 899mg 19%",6.402585718714538,6.123164645912397,8.439015157906049,5.8148123664921005,3.8295935376270087
Southern Style Banana Split Cake,"2 cups graham cracker crumbs, ¾ cup white sugar, ¼ pound butter, melted, 2 (8 ounce) packages cream cheese, 1 ½ cups confectioners' sugar, 4  bananas, sliced, 1 (15 ounce) can crushed pineapple, drained, 1 (16 ounce) container frozen whipped topping, thawed, 1 (16 ounce) jar maraschino cherries, drained, 12 ounces crushed peanuts",https://www.allrecipes.com/recipe/15439/southern-style-banana-split-cake/,"Total Fat 46g 59%, Saturated Fat 23g 117%, Cholesterol 61mg 20%, Sodium 262mg 11%, Total Carbohydrate 79g 29%, Dietary Fiber 4g 15%, Total Sugars 51g, Protein 12g, Vitamin C 7mg 34%, Calcium 66mg 5%, Iron 2mg 11%, Potassium 490mg 10%",7.061736913840641,7.182563911288437,7.701200844564967,6.196055209156457,7.733561245837027
Chocolate Banana Muffins,"1 ½ cups all-purpose flour, ¼ cup unsweetened cocoa powder, 1 ½ teaspoons baking powder, ½ teaspoon baking soda, ½ teaspoon salt, ½ cup white sugar, ½ cup canola oil, ¼ cup milk, 1  egg, 1 teaspoon vanilla extract, 2 large very ripe bananas, mashed, ¾  mini semisweet chocolate chips",https://www.allrecipes.com/recipe/269764/chocolate-banana-muffins/,"Total Fat 10g 13%, Saturated Fat 1g 6%, Cholesterol 14mg 5%, Sodium 219mg 10%, Total Carbohydrate 27g 10%, Dietary Fiber 2g 6%, Total Sugars 12g, Protein 3g, Vitamin C 2mg 10%, Calcium 48mg 4%, Iron 1mg 7%, Potassium 139mg 3%",6.866579378107614,4.90736914883354,6.306117850419378,3.297249317540458,5.050692797244272
Vegan Banana Muffins,"3 cups all-purpose flour, 1 cup white sugar, ½ cup brown sugar, 2 teaspoons ground cinnamon, 2 teaspoons baking powder, 1 teaspoon baking soda, 1 teaspoon ground nutmeg, 1 teaspoon salt, 2 cups mashed ripe bananas, 1 cup canola oil, 1 cup coconut milk",https://www.allrecipes.com/recipe/233146/vegan-banana-muffins/,"Total Fat 23g 30%, Saturated Fat 5g 26%, Sodium 386mg 17%, Total Carbohydrate 59g 22%, Dietary Fiber 2g 8%, Total Sugars 30g, Protein 4g, Vitamin C 4mg 18%, Calcium 67mg 5%, Iron 2mg 13%, Potassium 224mg 5%",7.483564228278477,6.348182282555337,6.875132838448946,3.8988058916159996,6.512591757728502
Pineapple and Banana Smoothie,"4  ice cubes, ¼  fresh pineapple - peeled, cored and cubed, 1 large banana, cut into chunks, 1 cup pineapple or apple juice",https://www.allrecipes.com/recipe/138159/pineapple-and-banana-smoothie/,"Total Fat 1g 1%, Saturated Fat 0g 1%, Sodium 10mg 0%, Total Carbohydrate 79g 29%, Dietary Fiber 6g 20%, Total Sugars 53g, Protein 3g, Vitamin C 93mg 466%, Calcium 57mg 4%, Iron 2mg 8%, Potassium 941mg 20%",3.5066094682241005,7.243049869177326,8.44931515886709,3.297249317540458,1.0
Sarah's Banana Bread Muffins,"1 cup white sugar, ½ cup vegetable oil, 1 large egg, 3  ripe bananas, mashed, ¼ cup chopped walnuts, 2 cups all-purpose flour, 1 teaspoon baking soda, ½ teaspoon salt",https://www.allrecipes.com/recipe/6990/sarahs-banana-bread-muffins/,"Total Fat 12g 15%, Saturated Fat 2g 8%, Cholesterol 16mg 5%, Sodium 208mg 9%, Total Carbohydrate 40g 14%, Dietary Fiber 2g 5%, Total Sugars 20g, Protein 3g, Vitamin C 3mg 13%, Calcium 9mg 1%, Iron 1mg 7%, Potassium 145mg 3%",6.810479503360792,5.710612314087722,6.0586040056824295,3.297249317540458,5.371119893422607
Air Fryer Roasted Bananas,"1  banana, sliced into 1/8-inch thick diagonals,   avocado oil cooking spray",https://www.allrecipes.com/recipe/272347/air-fryer-roasted-bananas/,"Total Fat 1g 1%, Saturated Fat 0g 1%, Sodium 1mg 0%, Total Carbohydrate 27g 10%, Dietary Fiber 3g 11%, Total Sugars 14g, Protein 1g, Vitamin C 10mg 52%, Calcium 6mg 0%, Iron 0mg 2%, Potassium 422mg 9%",1.0,5.1497620011687095,7.36107755588232,1.0,1.0
Banana Chocolate Chip Cookies,"2 ½ cups all-purpose flour, 2 teaspoons baking powder, ½ teaspoon salt, ¼ teaspoon baking soda, 1 cup white sugar, ⅔ cup butter, softened, 1 cup mashed bananas, 2  eggs, 1 teaspoon vanilla extract, 2 cups semisweet chocolate chips",https://www.allrecipes.com/recipe/11201/banana-chocolate-chip-cookies/,"Total Fat 13g 17%, Saturated Fat 8g 39%, Cholesterol 39mg 13%, Sodium 195mg 8%, Total Carbohydrate 39g 14%, Dietary Fiber 2g 7%, Total Sugars 23g, Protein 4g, Vitamin C 1mg 6%, Calcium 44mg 3%, Iron 2mg 9%, Potassium 142mg 3%",6.740222439402185,5.93037972541657,6.306117850419378,3.8988058916159996,5.514768878580383
Best Yet Banana Mini Muffins,"  cooking spray, 1 ½ cups all-purpose flour, 1 teaspoon baking powder, 1 teaspoon baking soda, 3  bananas, mashed, ¾ cup white sugar, ⅓ cup melted butter, 1  egg, beaten",https://www.allrecipes.com/recipe/246624/best-yet-banana-mini-muffins/,"Total Fat 2g 2%, Saturated Fat 1g 5%, Cholesterol 7mg 2%, Sodium 47mg 2%, Total Carbohydrate 8g 3%, Dietary Fiber 0g 1%, Total Sugars 4g, Protein 1g, Vitamin C 1mg 3%, Calcium 8mg 1%, Iron 0mg 1%, Potassium 32mg 1%",5.191296322498906,3.179866120243951,4.321611551522199,1.0,2.224782300679488
Homemade Banana Pudding,"⅔ cup white sugar, ⅓ cup all-purpose flour, ¼ teaspoon salt, 3  eggs, beaten, 2 cups milk, 2 tablespoons butter, softened, ½ teaspoon vanilla extract, 2  bananas, peeled and sliced, ½ (12 ounce) package vanilla wafer cookies",https://www.allrecipes.com/recipe/18990/banana-pudding-i/,"Total Fat 28g 36%, Saturated Fat 11g 55%, Cholesterol 505mg 168%, Sodium 382mg 17%, Total Carbohydrate 91g 33%, Dietary Fiber 3g 10%, Total Sugars 46g, Protein 14g, Vitamin C 5mg 27%, Calcium 211mg 16%, Iron 3mg 16%, Potassium 489mg 10%",7.472224473029051,7.020312785538545,7.997419474444479,6.518391439766877,6.889859596425428
Banana Pumpkin Bread,"2  ripe bananas, mashed, 1 ⅓ cups canned pumpkin puree, ½ cup honey, ½ cup white sugar, ⅓ cup vegetable oil, 2 large eggs, 2 ½ cups all-purpose flour, 2 teaspoons pumpkin pie spice, 1 teaspoon baking powder, 1 teaspoon baking soda, 1 teaspoon ground cinnamon, ½ teaspoon salt, ¾ cup raisins (Optional), ½ cup walnut pieces (Optional)",https://www.allrecipes.com/recipe/16706/banana-pumpkin-bread/,"Total Fat 11g 14%, Saturated Fat 2g 8%, Cholesterol 31mg 10%, Sodium 258mg 11%, Total Carbohydrate 56g 20%, Dietary Fiber 3g 10%, Total Sugars 30g, Protein 5g, Vitamin C 3mg 17%, Calcium 54mg 4%, Iron 2mg 13%, Potassium 275mg 6%",7.044988788723253,6.348182282555337,7.031509165803916,4.3654094206841,5.220748131342084
Banana Bread - Quick Bread for Machines,"2  bananas, peeled and halved lengthwise, 2 cups all-purpose flour, ¾ cup white sugar, 2 large eggs, 3 tablespoons vegetable oil, 1 teaspoon baking powder, ½ teaspoon baking soda",https://www.allrecipes.com/recipe/7116/banana-bread-quick-bread-for-machines/,"Total Fat 5g 7%, Saturated Fat 1g 5%, Cholesterol 37mg 12%, Sodium 126mg 5%, Total Carbohydrate 40g 14%, Dietary Fiber 1g 5%, Total Sugars 18g, Protein 4g, Vitamin C 2mg 11%, Calcium 37mg 3%, Iron 2mg 8%, Potassium 125mg 3%",6.264808695170698,5.544939117301153,6.13098113835271,3.8988058916159996,3.8425557636587464
Banana Fritters,"2  bananas, mashed, ½ cup milk, 2 cups all-purpose flour, 3 teaspoons baking powder, ½ teaspoon salt, 2  eggs, beaten, 1 tablespoon margarine, melted, 1 quart vegetable oil for frying, ½ cup confectioners' sugar, or as needed",https://www.allrecipes.com/recipe/20490/banana-fritters/,"Total Fat 19g 24%, Saturated Fat 3g 16%, Cholesterol 64mg 21%, Sodium 427mg 19%, Total Carbohydrate 53g 19%, Dietary Fiber 2g 8%, Total Sugars 16g, Protein 8g, Vitamin C 4mg 18%, Calcium 141mg 11%, Iron 3mg 14%, Potassium 240mg 5%",7.593455417018325,5.359732240487902,7.22196813825449,5.348208837423999,6.182604863904743
Blueberry Banana Bread,"2 cups all-purpose flour, 1 teaspoon baking soda, ½ teaspoon salt, 1 cup white sugar, ½ cup butter, softened, 2 large eggs, 2 teaspoons vanilla extract, 2  ripe bananas, mashed, 1 cup fresh blueberries",https://www.allrecipes.com/recipe/229021/blueberry-banana-bread/,"Total Fat 7g 9%, Saturated Fat 4g 21%, Cholesterol 41mg 14%, Sodium 215mg 9%, Total Carbohydrate 31g 11%, Dietary Fiber 1g 4%, Total Sugars 16g, Protein 3g, Vitamin C 2mg 12%, Calcium 10mg 1%, Iron 1mg 6%, Potassium 94mg 2%",6.846512327674495,5.359732240487902,5.559176500503064,3.297249317540458,4.431421445948944
Almost No Fat Banana Bread,"  cooking spray, 1 ½ cups all-purpose flour, ¾ cup white sugar, 1 ¼ teaspoons baking powder, ½ teaspoon baking soda, ½ teaspoon ground cinnamon, 1 cup banana, mashed, ¼ cup applesauce, 2  egg whites",https://www.allrecipes.com/recipe/23426/almost-no-fat-banana-bread/,"Total Fat 0g 0%, Sodium 100mg 4%, Total Carbohydrate 30g 11%, Dietary Fiber 1g 4%, Total Sugars 15g, Protein 2g, Vitamin C 2mg 9%, Calcium 26mg 2%, Iron 1mg 4%, Potassium 98mg 2%",6.013218936448201,5.258249222433361,5.782757385329451,2.449402945808,0.0
Banana Chocolate Chip Cake,"1 ½ cups all-purpose flour, ⅔ cup white sugar, 1 ½ teaspoons baking powder, ¼ teaspoon salt, 1 cup mashed bananas, ½ cup unsalted butter, melted, ¼ cup milk, 1 large egg, ¾ cup semisweet chocolate chips",https://www.allrecipes.com/recipe/8302/banana-chocolate-chip-cake/,"Total Fat 6g 7%, Saturated Fat 4g 18%, Cholesterol 18mg 6%, Sodium 60mg 3%, Total Carbohydrate 17g 6%, Dietary Fiber 1g 3%, Total Sugars 10g, Protein 2g, Vitamin C 1mg 4%, Calcium 26mg 2%, Iron 1mg 3%, Potassium 69mg 1%",5.457130760146163,4.620679253965748,5.444262955896065,2.449402945808,4.1554041623639115
Hearty Breakfast Muffins,"2  carrots, shredded, 2  bananas, mashed, 1  zucchini, shredded, ¼ cup vegetable oil, ¼ cup yogurt, 2  eggs, 1 cup whole wheat flour, 1 ½ teaspoons baking soda, ½ cup packed brown sugar, ½ cup rolled oats, ½ cup shredded coconut, ½ cup chopped pecans, ½ cup dried cherries, 1 teaspoon ground cinnamon, 1 teaspoon salt, ½ teaspoon ground ginger",https://www.allrecipes.com/recipe/231643/hearty-breakfast-muffins/,"Total Fat 10g 13%, Saturated Fat 2g 11%, Cholesterol 31mg 10%, Sodium 388mg 17%, Total Carbohydrate 32g 12%, Dietary Fiber 4g 14%, Total Sugars 17g, Protein 5g, Vitamin C 5mg 26%, Calcium 42mg 3%, Iron 1mg 6%, Potassium 265mg 6%",7.4891901150133755,5.455060882698847,6.939156611734219,4.3654094206841,5.053674901263212
Bob's Stuffed Banana Peppers,"8  banana peppers, 2 tablespoons butter, ½ cup chopped onion, ½ cup chopped celery, 1 (28 ounce) can crushed tomatoes, 1 (8 ounce) can tomato sauce, 2 cloves garlic, minced, 2 ½ teaspoons salt, divided, 1 teaspoon dried basil, 1 teaspoon dried oregano, ½ teaspoon ground black pepper, divided, ½ cup grated Parmesan cheese, 1 large egg, 1 teaspoon Worcestershire sauce, 1 pound hot Italian sausage, 1 pound mild Italian sausage, 1 ½ cups bread crumbs",https://www.allrecipes.com/recipe/23074/bobs-stuffed-banana-peppers/,"Total Fat 43g 54%, Saturated Fat 16g 81%, Cholesterol 123mg 41%, Sodium 2125mg 92%, Total Carbohydrate 29g 10%, Dietary Fiber 5g 19%, Total Sugars 4g, Protein 25g, Vitamin C 53mg 264%, Calcium 189mg 15%, Iron 5mg 25%, Potassium 893mg 19%",9.340389409112829,3.179866120243951,8.556290292914163,7.730818841368199,7.6176830172841985
Easy Kids' Recipe for Fluffy Banana Cookies,"2  ripe bananas, mashed, or more to taste, 1 ½ cups all-purpose flour, ½ cup white sugar, or more to taste, ¼ cup butter, melted, ¼ cup chopped walnuts (Optional), 1  egg, 1 teaspoon baking soda, ¼ teaspoon salt, 1 tablespoon white sugar",https://www.allrecipes.com/recipe/258838/easy-kids-recipe-for-fluffy-banana-cookies/,"Total Fat 6g 8%, Saturated Fat 3g 14%, Cholesterol 24mg 8%, Sodium 186mg 8%, Total Carbohydrate 26g 10%, Dietary Fiber 1g 4%, Total Sugars 12g, Protein 3g, Vitamin C 2mg 9%, Calcium 9mg 1%, Iron 1mg 5%, Potassium 104mg 2%",6.6887826342337835,4.90736914883354,5.664633968645014,3.297249317540458,4.157156155847741
Easy Mango Banana Smoothie,"2  mangos - peeled, seeded, and sliced, 2  bananas, 2 cups vanilla yogurt, 2 cups milk",https://www.allrecipes.com/recipe/231851/easy-mango-banana-smoothie/,"Total Fat 2g 3%, Saturated Fat 1g 7%, Cholesterol 8mg 3%, Sodium 67mg 3%, Total Carbohydrate 24g 9%, Dietary Fiber 1g 5%, Total Sugars 21g, Protein 6g, Vitamin C 14mg 68%, Calcium 181mg 14%, Iron 0mg 1%, Potassium 390mg 8%",5.577256390135347,5.787331969636323,7.730733526136402,4.746652263348457,2.225658079186031
Strawberry Banana Protein Smoothie,"1 ¼ cups sliced fresh strawberries, 1  banana, 10  whole almonds, 2 tablespoons water, 1 cup ice cubes, 3 tablespoons chocolate flavored protein powder",https://www.allrecipes.com/recipe/160708/strawberry-banana-protein-smoothie/,"Total Fat 8g 10%, Saturated Fat 1g 4%, Sodium 195mg 8%, Total Carbohydrate 53g 19%, Dietary Fiber 10g 36%, Total Sugars 25g, Protein 21g, Vitamin C 132mg 662%, Calcium 200mg 15%, Iron 14mg 78%, Potassium 936mg 20%",6.740222439402185,6.061492387687543,8.628537938837201,7.366237811499337,4.655918816595748
Porridge,"2 ½ cups water, 1 cup rolled oats, 1 tablespoon white sugar, 1 teaspoon salt, 2  bananas, sliced, 1 pinch ground cinnamon, ½ cup cold milk (Optional)",https://www.allrecipes.com/recipe/73155/porridge/,"Total Fat 2g 3%, Saturated Fat 1g 4%, Cholesterol 2mg 1%, Sodium 600mg 26%, Total Carbohydrate 32g 12%, Dietary Fiber 4g 13%, Total Sugars 12g, Protein 4g, Vitamin C 5mg 26%, Calcium 57mg 4%, Iron 1mg 6%, Potassium 333mg 7%",7.9637402283702645,4.90736914883354,7.24513367810721,3.8988058916159996,2.2203968523703925
Brown Sugar Banana Bread,"4  ripe bananas, cut into chunks, 1 ¼ cups light brown sugar, ½ cup butter, softened, 1  egg, 1 teaspoon cinnamon, 1 teaspoon vanilla extract, ¼ cup whole milk, 2 cups all-purpose flour, ½ teaspoon baking soda, 1 teaspoon baking powder, ½ teaspoon kosher salt",https://www.allrecipes.com/recipe/214581/brown-sugar-banana-bread/,"Total Fat 13g 17%, Saturated Fat 8g 39%, Cholesterol 55mg 18%, Sodium 364mg 16%, Total Carbohydrate 72g 26%, Dietary Fiber 3g 9%, Total Sugars 41g, Protein 5g, Vitamin C 5mg 26%, Calcium 88mg 7%, Iron 2mg 12%, Potassium 315mg 7%",7.419680977336568,6.839373051156013,7.2902458807361,4.3654094206841,5.516924930437046
Hummingbird Cake,"3 cups all-purpose flour, 2 cups white sugar, 1 teaspoon baking soda, 1 teaspoon salt, 2 cups mashed bananas, 1 ½ cups canola oil, 1 cup chopped black walnuts, 1 (8 ounce) can crushed pineapple, drained, 3 large eggs",https://www.allrecipes.com/recipe/15750/hummingbird-cake/,"Total Fat 40g 51%, Saturated Fat 10g 48%, Cholesterol 70mg 23%, Sodium 342mg 15%, Total Carbohydrate 86g 31%, Dietary Fiber 2g 8%, Total Sugars 62g, Protein 7g, Vitamin C 4mg 21%, Calcium 32mg 2%, Iron 2mg 11%, Potassium 231mg 5%",7.351813830167355,7.489675405146944,6.7463307160914745,5.068988493958879,7.48858638453225
Clean Banana Oat Cookies,"2  bananas, mashed, ¼ cup milk, 1 large egg, beaten, 1 teaspoon honey, ½ teaspoon vanilla extract, 1 cup rolled oats, or as needed, 1 teaspoon ground cinnamon, ½ teaspoon baking powder, ⅛ teaspoon salt",https://www.allrecipes.com/recipe/254832/clean-banana-oat-cookies/,"Total Fat 1g 1%, Saturated Fat 0g 2%, Cholesterol 16mg 5%, Sodium 53mg 2%, Total Carbohydrate 10g 4%, Dietary Fiber 1g 5%, Total Sugars 3g, Protein 2g, Vitamin C 2mg 9%, Calcium 26mg 2%, Iron 1mg 3%, Potassium 110mg 2%",5.3220862205716815,2.727503028589589,5.900306183524765,2.449402945808,1.0279073369939487
Quick Banana Milkshake (Ice Cream Free),"3  ice cubes, 1 cup milk, 1  banana, 1 tablespoon white sugar, or to taste, 1 pinch ground cinnamon",https://www.allrecipes.com/recipe/231180/quick-banana-milkshake-ice-cream-free/,"Total Fat 3g 3%, Saturated Fat 2g 8%, Cholesterol 10mg 3%, Sodium 52mg 2%, Total Carbohydrate 26g 9%, Dietary Fiber 2g 6%, Total Sugars 19g, Protein 5g, Vitamin C 5mg 27%, Calcium 152mg 12%, Iron 0mg 1%, Potassium 397mg 8%",5.301350228659202,5.629956633903902,7.6803492757839615,4.3654094206841,2.937348748668416
Banana Bran Muffins,"½ cup butter, softened, ½ cup brown sugar, 3  bananas, mashed, 2 large eggs, ¼ cup milk, 1 teaspoon vanilla extract, 1 ½ cups all-purpose flour, ½ cup wheat bran, 1 teaspoon baking powder, 1 teaspoon baking soda, ¼ teaspoon salt, ½ cup chopped walnuts",https://www.allrecipes.com/recipe/16666/banana-bran-muffins/,"Total Fat 12g 16%, Saturated Fat 6g 28%, Cholesterol 52mg 17%, Sodium 266mg 12%, Total Carbohydrate 30g 11%, Dietary Fiber 3g 9%, Total Sugars 13g, Protein 4g, Vitamin C 3mg 13%, Calcium 53mg 4%, Iron 2mg 8%, Potassium 207mg 4%",7.078231269702185,5.033231585790421,6.731730825267367,3.8988058916159996,5.376379371448262
Strawberry Orange Banana Smoothie,"1 cup fresh strawberries, ¾ cup orange juice, 1  ripe banana, 1 cup ice cubes, or as needed",https://www.allrecipes.com/recipe/215163/strawberry-orange-banana-smoothie/,"Total Fat 1g 2%, Saturated Fat 0g 1%, Sodium 8mg 0%, Total Carbohydrate 58g 21%, Dietary Fiber 7g 23%, Total Sugars 38g, Protein 4g, Vitamin C 194mg 971%, Calcium 55mg 4%, Iron 1mg 7%, Potassium 1032mg 22%",3.263693912052385,6.719889694025877,8.557469459181505,3.8988058916159996,1.0
Banana Loaf,"1 cup white sugar, ½ cup butter, 2 large eggs, 3  ripe bananas, mashed, 2 cups all-purpose flour, 1 teaspoon baking soda, 1 teaspoon baking powder, ½ teaspoon salt, ½ cup chopped walnuts",https://www.allrecipes.com/recipe/20739/banana-loaf/,"Total Fat 12g 15%, Saturated Fat 6g 28%, Cholesterol 51mg 17%, Sodium 299mg 13%, Total Carbohydrate 40g 15%, Dietary Fiber 2g 6%, Total Sugars 21g, Protein 4g, Vitamin C 3mg 13%, Calcium 33mg 3%, Iron 1mg 8%, Potassium 163mg 3%",7.205540840863625,5.787331969636323,6.366082484138149,3.8988058916159996,5.376233487092246
Southern-Style Baked Banana Pudding,4 large eggs,https://www.allrecipes.com/recipe/273495/southern-style-baked-banana-pudding/,"Total Fat 14g 17%, Saturated Fat 5g 23%, Cholesterol 102mg 34%, Sodium 272mg 12%, Total Carbohydrate 64g 23%, Dietary Fiber 2g 8%, Total Sugars 25g, Protein 8g, Vitamin C 4mg 22%, Calcium 99mg 8%, Iron 2mg 10%, Potassium 345mg 7%",7.102513465896094,6.061492387687543,7.413904655065153,5.348208837423999,5.652556262395764
Healthy Chocolate Smoothie,"2  very ripe bananas, 1 cup milk, 6  ice cubes, 1 ½ tablespoons unsweetened cocoa powder, 1 tablespoon peanut butter, 1 teaspoon vanilla extract",https://www.allrecipes.com/recipe/245061/healthy-chocolate-smoothie/,"Total Fat 7g 9%, Saturated Fat 3g 14%, Cholesterol 10mg 3%, Sodium 92mg 4%, Total Carbohydrate 37g 13%, Dietary Fiber 5g 18%, Total Sugars 21g, Protein 8g, Vitamin C 11mg 53%, Calcium 159mg 12%, Iron 1mg 6%, Potassium 724mg 15%",5.922449161607603,5.787331969636323,8.291204526436838,5.348208837423999,4.423663710099303
Simple Banana Bread,"  cooking spray, 2 cups all-purpose flour, 1 teaspoon baking powder, ½ teaspoon salt, 4  ripe bananas, mashed, 2 large eggs, ⅔ cup white sugar, ½ cup chopped walnuts",https://www.allrecipes.com/recipe/6757/simple-banana-bread/,"Total Fat 5g 7%, Saturated Fat 1g 4%, Cholesterol 37mg 12%, Sodium 180mg 8%, Total Carbohydrate 44g 16%, Dietary Fiber 2g 8%, Total Sugars 19g, Protein 5g, Vitamin C 4mg 21%, Calcium 44mg 3%, Iron 2mg 9%, Potassium 235mg 5%",6.653087414717432,5.629956633903902,6.821507886796874,4.3654094206841,3.8425557636587464
Overnight Chia Oats,"1 cup Almond Breeze Vanilla almondmilk, ½ cup rolled oats, ½ medium banana, mashed, 1 tablespoon chia seeds",https://www.allrecipes.com/recipe/269573/overnight-chia-oats/,"Total Fat 9g 11%, Saturated Fat 1g 4%, Sodium 155mg 7%, Total Carbohydrate 60g 22%, Dietary Fiber 10g 34%, Total Sugars 21g, Protein 9g, Vitamin C 7mg 34%, Calcium 90mg 7%, Iron 3mg 16%, Potassium 375mg 8%",6.490306173185025,5.787331969636323,7.475648640018496,5.594498635080916,4.862996153323419
Easy Banana Brownies,"½ cup unsalted butter, ⅔ cup semisweet chocolate chips, 1 large egg, ⅔ cup packed light brown sugar, 1 small ripe banana, mashed, ½ teaspoon vanilla extract, ¼ teaspoon salt, ¾ cup all-purpose flour",https://www.allrecipes.com/recipe/159329/easy-banana-brownies/,"Total Fat 8g 11%, Saturated Fat 5g 25%, Cholesterol 27mg 9%, Sodium 85mg 4%, Total Carbohydrate 19g 7%, Dietary Fiber 1g 3%, Total Sugars 14g, Protein 1g, Vitamin C 1mg 3%, Calcium 14mg 1%, Iron 1mg 3%, Potassium 73mg 2%",5.836299747366218,5.1497620011687095,5.332684506082813,1.0,4.661842498935123
Easy Banana Loaf Cake,"1 ½ cups all-purpose flour, 1 cup white sugar, ¼ cup butter, softened, 1 teaspoon vanilla extract, 1 teaspoon baking soda, ½ teaspoon baking powder, 1  egg, 3  very ripe bananas",https://www.allrecipes.com/recipe/8301/banana-loaf-cake-i/,"Total Fat 7g 9%, Saturated Fat 4g 20%, Cholesterol 39mg 13%, Sodium 238mg 10%, Total Carbohydrate 53g 19%, Dietary Fiber 2g 6%, Total Sugars 31g, Protein 4g, Vitamin C 4mg 19%, Calcium 28mg 2%, Iron 1mg 8%, Potassium 195mg 4%",6.9571503025210735,6.399742345024968,6.530789627038797,3.8988058916159996,4.4309219785264
Cream Cheese Banana Bread,  cooking spray,https://www.allrecipes.com/recipe/256401/cream-cheese-banana-bread/,"Total Fat 20g 25%, Saturated Fat 12g 59%, Cholesterol 96mg 32%, Sodium 324mg 14%, Total Carbohydrate 48g 17%, Dietary Fiber 1g 5%, Total Sugars 30g, Protein 5g, Vitamin C 3mg 13%, Calcium 63mg 5%, Iron 2mg 8%, Potassium 192mg 4%",7.292955892986665,6.348182282555337,6.707022098871012,4.3654094206841,6.275291561180861
Kiwi Jam,"24  kiwis, peeled and mashed, ¾ cup pineapple juice, ¼ cup fresh lemon juice, 3  apples, unpeeled and halved, 4 cups white sugar",https://www.allrecipes.com/recipe/25904/kiwi-jam/,"Total Fat 0g 0%, Sodium 2mg 0%, Total Carbohydrate 29g 10%, Dietary Fiber 2g 6%, Total Sugars 26g, Protein 1g, Vitamin C 43mg 214%, Calcium 17mg 1%, Iron 0mg 1%, Potassium 158mg 3%",1.7545646373507955,6.123164645912397,6.214230278487624,1.0,0.0
Kiwi Banana Apple Smoothie,"1  apple, roughly chopped, 1  banana, broken into chunks, 2  kiwifruit, peeled, 1 ¼ cups milk, ¼ cup ice, or as desired, 2 teaspoons chia seeds, 1 teaspoon maca powder",https://www.allrecipes.com/recipe/241259/kiwi-banana-apple-smoothie/,"Total Fat 5g 6%, Saturated Fat 2g 11%, Cholesterol 12mg 4%, Sodium 67mg 3%, Total Carbohydrate 44g 16%, Dietary Fiber 7g 25%, Total Sugars 28g, Protein 8g, Vitamin C 78mg 388%, Calcium 227mg 17%, Iron 1mg 4%, Potassium 749mg 16%",5.577256390135347,6.239695061290686,8.419476792747616,5.348208837423999,3.833807983070263
PHILADELPHIA® Fruit Pizza,"1 (16.5 ounce) package refrigerated sliceable sugar cookies, sliced, 1 (8 ounce) package PHILADELPHIA Cream Cheese, softened, ¼ cup sugar, ½ teaspoon vanilla, 4 cups assorted cut-up fruit (kiwi, strawberries, blueberries, drained canned mandarin oranges), ¼ cup apricot preserves, pressed through sieve to remove lumps, 1 tablespoon water",https://www.allrecipes.com/recipe/136145/philadelphia-fruit-pizza/,"Total Fat 15g 20%, Saturated Fat 6g 29%, Cholesterol 25mg 8%, Sodium 218mg 9%, Total Carbohydrate 36g 13%, Dietary Fiber 1g 4%, Total Sugars 17g, Protein 3g, Vitamin C 30mg 149%, Calcium 9mg 1%, Iron 1mg 7%, Potassium 91mg 2%",6.861597187899433,5.455060882698847,5.509370503375237,3.297249317540458,5.764019384016992
Fruit Pizza Even Better,"  butter-flavored cooking spray, 2 cups all-purpose flour, ½ cup confectioners' sugar, 1 cup cold butter, 1 (8 ounce) package cream cheese, softened, ⅓ cup white sugar, 1 teaspoon almond extract, 2 cups sliced fresh strawberries, 1 cup fresh blueberries, 1  kiwi, peeled and sliced, 1 cup unsweetened pineapple juice, ½ cup white sugar, 2 tablespoons cornstarch, 1 teaspoon lemon juice",https://www.allrecipes.com/recipe/228837/fruit-pizza-even-better/,"Total Fat 17g 21%, Saturated Fat 10g 52%, Cholesterol 46mg 15%, Sodium 124mg 5%, Total Carbohydrate 33g 12%, Dietary Fiber 1g 4%, Total Sugars 18g, Protein 3g, Vitamin C 19mg 96%, Calcium 25mg 2%, Iron 1mg 6%, Potassium 111mg 2%",6.24739061701331,5.544939117301153,5.900306183524765,3.297249317540458,5.985894960019982
Fresh Fruit Tart with Mascarpone,"2 cups all-purpose flour, 1 cup butter, softened, ½ cup white sugar",https://www.allrecipes.com/recipe/273048/fresh-fruit-tart-with-mascarpone/,"Total Fat 23g 30%, Saturated Fat 14g 70%, Cholesterol 63mg 21%, Sodium 132mg 6%, Total Carbohydrate 43g 16%, Dietary Fiber 2g 8%, Total Sugars 28g, Protein 4g, Vitamin C 28mg 141%, Calcium 51mg 4%, Iron 1mg 6%, Potassium 141mg 3%",6.315450694029785,6.239695061290686,6.339777085304698,3.8988058916159996,6.517400908845087
