recipe_name,ingredients,url,nutrition,salt_score,sweet_score,bitter_score,umami_score,richness_score
Simple Avocado Milkshake,"1 cup milk, 1  ripe avocado, peeled and pitted, 1  banana, cut into chunks, 3 tablespoons honey",https://www.allrecipes.com/recipe/237804/simple-avocado-milkshake/,"Total Fat 12g 15%, Saturated Fat 3g 13%, Cholesterol 7mg 2%, Sodium 39mg 2%, Total Carbohydrate 36g 13%, Dietary Fiber 6g 20%, Total Sugars 26g, Protein 5g, Vitamin C 10mg 52%, Calcium 106mg 8%, Iron 1mg 3%, Potassium 599mg 13%",4.98817760852888,6.123164645912397,8.00288013518184,4.3654094206841,5.369802561817056
Avocado Tomatillo Salsa,"6 ounces fresh tomatillos - husked, rinsed, and halved, 1 tablespoon thinly sliced serrano chiles, or to taste, 1 large ripe avocado - halved, seeded, and flesh scooped out of peel, ¼ cup packed cilantro leaves, ½  lime, juiced,   salt to taste",https://www.allrecipes.com/recipe/233271/avocado-tomatillo-salsa/,"Total Fat 7g 9%, Saturated Fat 1g 5%, Sodium 5mg 0%, Total Carbohydrate 6g 2%, Dietary Fiber 4g 14%, Total Sugars 2g, Protein 1g, Vitamin C 11mg 54%, Calcium 11mg 1%, Iron 1mg 3%, Potassium 325mg 7%",2.752044830873305,2.089933060121975,7.054545891173378,1.0,4.421153894804362
Avocado Mango Salsa,"1  avocado - peeled, pitted and diced, 1  lime, juiced, 1  mango - peeled, seeded and diced, 1 small red onion, chopped, 1  habanero pepper, seeded and chopped, 1 tablespoon chopped fresh cilantro,   salt to taste",https://www.allrecipes.com/recipe/89595/avocado-mango-salsa/,"Total Fat 4g 5%, Saturated Fat 1g 3%, Sodium 3mg 0%, Total Carbohydrate 8g 3%, Dietary Fiber 3g 9%, Total Sugars 5g, Protein 1g, Vitamin C 13mg 66%, Calcium 11mg 1%, Iron 0mg 2%, Potassium 188mg 4%",2.195956654571268,3.5307461938437714,6.379035556145311,1.0,3.437279211063832
Filipino Avocado Milkshake,"1  avocado - peeled, pitted, and cubed, 5 cubes  ice, 3 tablespoons white sugar, 1 ⅓ cups milk, 1 teaspoon fresh lemon or lime juice, 1 scoop vanilla ice cream",https://www.allrecipes.com/recipe/139425/filipino-avocado-milkshake/,"Total Fat 19g 24%, Saturated Fat 5g 25%, Cholesterol 18mg 6%, Sodium 84mg 4%, Total Carbohydrate 38g 14%, Dietary Fiber 7g 24%, Total Sugars 29g, Protein 8g, Vitamin C 12mg 59%, Calcium 218mg 17%, Iron 1mg 3%, Potassium 757mg 16%",5.823416677950224,6.294874092033796,8.418163589125044,5.348208837423999,6.178357513248369
Black Bean Avocado Salsa,"1 (15 ounce) can black beans (such as Bush's®), rinsed and drained, 1 (11 ounce) can whole kernel sweet corn, drained, 4  roma (plum) tomatoes, seeded and chopped, 1 small red bell pepper, diced, 1  jalapeno pepper, seeded and minced, ⅓ cup chopped fresh cilantro, ¼ cup diced red onion, ¼ cup fresh lime juice, 2 tablespoons red wine vinegar, 1 teaspoon salt, ½ teaspoon ground black pepper, 2  avocados, diced",https://www.allrecipes.com/recipe/229020/black-bean-avocado-salsa/,"Total Fat 6g 8%, Saturated Fat 1g 5%, Sodium 493mg 21%, Total Carbohydrate 19g 7%, Dietary Fiber 7g 25%, Total Sugars 3g, Protein 5g, Vitamin C 21mg 106%, Calcium 28mg 2%, Iron 1mg 8%, Potassium 471mg 10%",7.749915584338405,2.727503028589589,7.560462567687876,4.3654094206841,4.150137682193625
"Spinach Salad with Chicken, Avocado, and Goat Cheese","¼ cup pine nuts, 8 cups chopped spinach, 1 cup halved cherry tomatoes, 1 ½ cups chopped cooked chicken , 1 large avocado - peeled, pitted, and sliced, ½ cup corn kernels, ⅓ cup crumbled goat cheese",https://www.allrecipes.com/recipe/240327/spinach-salad-with-chicken-avocado-and-goat-cheese/,"Total Fat 32g 41%, Saturated Fat 8g 41%, Cholesterol 54mg 18%, Sodium 355mg 15%, Total Carbohydrate 18g 7%, Dietary Fiber 8g 30%, Total Sugars 2g, Protein 26g, Vitamin C 46mg 228%, Calcium 176mg 14%, Iron 5mg 28%, Potassium 1229mg 26%",7.3924265359014525,2.089933060121975,8.889915088600493,7.812831174066623,7.096162363673885
Best Guacamole,"2  avocados, ½  lemon, juiced, 2 tablespoons chopped onion, ½ teaspoon salt, 2 tablespoons olive oil",https://www.allrecipes.com/recipe/14837/best-guacamole/,"Total Fat 5g 7%, Saturated Fat 1g 4%, Sodium 75mg 3%, Total Carbohydrate 3g 1%, Dietary Fiber 2g 7%, Total Sugars 0g, Protein 1g, Vitamin C 5mg 26%, Calcium 5mg 0%, Iron 0mg 1%, Potassium 129mg 3%",5.700046316317878,0.0,5.871913660753933,1.0,3.8295935376270087
Avocado Quick Bread,"2 ⅔ cups all-purpose flour, 1 ½ teaspoons baking soda, 1 teaspoon baking powder, ¾ teaspoon salt, ¾ teaspoon ground cinnamon, ¾ teaspoon ground allspice, ½ cup butter, softened, 1 ⅞ cups white sugar, 3  eggs, 1 ½ cups mashed ripe avocado, ¾ cup buttermilk, ¾ cup chopped pecans, ½ cup raisins, 1 tablespoon grated orange zest",https://www.allrecipes.com/recipe/27341/avocado-quick-bread/,"Total Fat 11g 14%, Saturated Fat 4g 19%, Cholesterol 41mg 14%, Sodium 255mg 11%, Total Carbohydrate 38g 14%, Dietary Fiber 2g 8%, Total Sugars 22g, Protein 4g, Vitamin C 2mg 12%, Calcium 38mg 3%, Iron 1mg 7%, Potassium 177mg 4%",7.032256401937486,5.860481950506044,6.484153824913408,3.8988058916159996,5.222341213469509
Chicken Stuffed Baked Avocados,"4  avocados, halved and pitted, 2  cooked chicken breasts, shredded, 4 ounces cream cheese, softened, ¼ cup chopped tomatoes, ¼ teaspoon salt, ¼ teaspoon ground black pepper, 1 pinch cayenne pepper, ½ cup shredded Parmesan cheese, or more to taste",https://www.allrecipes.com/recipe/245863/chicken-stuffed-baked-avocados/,"Total Fat 25g 32%, Saturated Fat 7g 37%, Cholesterol 61mg 20%, Sodium 233mg 10%, Total Carbohydrate 9g 3%, Dietary Fiber 7g 24%, Total Sugars 1g, Protein 20g, Vitamin C 11mg 54%, Calcium 87mg 7%, Iron 1mg 7%, Potassium 623mg 13%",6.934036766300205,1.0,8.011929877930738,7.2642153123001,6.663471675934229
Mexican Pizza I,"1 (16 ounce) can refried beans, 1 pound ground beef, 1 (1.25 ounce) package taco seasoning mix, 1 tablespoon vegetable oil, 4 (6 inch) corn tortillas, 8 ounces shredded Cheddar cheese, 8 tablespoons sour cream, 2  roma (plum) tomatoes, chopped, 2  green onion, chopped, 1 (4 ounce) can diced green chiles, drained, ½  avocado, diced, 1 tablespoon black olives, sliced",https://www.allrecipes.com/recipe/17368/mexican-pizza-i/,"Total Fat 48g 62%, Saturated Fat 23g 114%, Cholesterol 150mg 50%, Sodium 1542mg 67%, Total Carbohydrate 42g 15%, Dietary Fiber 10g 37%, Total Sugars 4g, Protein 42g, Vitamin C 24mg 122%, Calcium 534mg 41%, Iron 5mg 29%, Potassium 866mg 18%",8.991282476651165,3.179866120243951,8.885359690469318,8.815640757307337,7.811542073646907
Carne Asada Tacos,"1 ½ pounds boneless beef top sirloin, cut into thin bite-size slices, ½ teaspoon salt, 1 teaspoon freshly ground black pepper,   crushed red pepper to taste, 1  lime, 1 (28 ounce) can tomatillos, 2  fresh jalapeno peppers, seeded, 4 tablespoons canola oil, divided, 1 (10.5 ounce) can beef broth, 12 (6 inch) corn tortillas, ½ large onion, chopped, 2  tomatoes, chopped, 1  avocado - peeled, pitted and sliced, 1 bunch fresh cilantro, chopped, 1  lemon",https://www.allrecipes.com/recipe/37336/carne-asada-tacos/,"Total Fat 23g 29%, Saturated Fat 4g 19%, Cholesterol 69mg 23%, Sodium 873mg 38%, Total Carbohydrate 40g 15%, Dietary Fiber 13g 46%, Total Sugars 5g, Protein 30g, Vitamin C 32mg 161%, Calcium 128mg 10%, Iron 5mg 29%, Potassium 1128mg 24%",8.371974149454323,3.5307461938437714,8.746697037619292,8.112061684032557,6.517858237898787
Smoked Salmon Sushi Roll,"2 cups Japanese sushi rice, 6 tablespoons rice wine vinegar, 6 sheets nori (dry seaweed), 1  avocado - peeled, pitted and sliced, 1  cucumber, peeled and sliced, 8 ounces smoked salmon, cut into long strips, 2 tablespoons wasabi paste",https://www.allrecipes.com/recipe/19511/smoked-salmon-sushi-roll/,"Total Fat 7g 9%, Saturated Fat 1g 6%, Cholesterol 9mg 3%, Sodium 405mg 18%, Total Carbohydrate 45g 16%, Dietary Fiber 4g 14%, Total Sugars 0g, Protein 11g, Vitamin C 5mg 27%, Calcium 16mg 1%, Iron 3mg 14%, Potassium 323mg 7%",7.53587144915838,0.0,7.073431994332899,6.014110378874236,4.423412889738576
Avocado Deviled Eggs,"6  hard-boiled eggs, peeled and halved, 1  avocado - peeled, pitted, and diced, 3 slices cooked turkey bacon, chopped, divided, 2 ½ tablespoons mayonnaise, 2 teaspoons lime juice, 1 clove garlic, crushed, ⅛ teaspoon cayenne pepper,   sea salt to taste, 1  jalapeno pepper, sliced (Optional), 1 dash hot sauce, or to taste (Optional)",https://www.allrecipes.com/recipe/236809/avocado-deviled-eggs/,"Total Fat 9g 11%, Saturated Fat 2g 10%, Cholesterol 113mg 38%, Sodium 162mg 7%, Total Carbohydrate 2g 1%, Dietary Fiber 1g 4%, Total Sugars 1g, Protein 5g, Vitamin C 3mg 13%, Calcium 18mg 1%, Iron 1mg 4%, Potassium 133mg 3%",6.5383912556358705,1.0,6.033541125315555,4.3654094206841,4.8849329653504725
Mexican Chicken and Rice Soup (Sopa de Pollo y Arroz),"2 ½ quarts chicken stock, 2 pounds skin-on, bone-in whole chicken legs (drumsticks and thighs), 3  carrots, chopped, 1  white onion, chopped, 2 stalks celery, chopped, ¼ cup chopped fresh cilantro, 1 clove garlic, 1 tablespoon chopped fresh mint,   salt and ground black pepper to taste, 3 cups cooked rice, 1  avocado, peeled and chopped, 2  serrano peppers, minced, 2  limes, quartered",https://www.allrecipes.com/recipe/262306/mexican-chicken-and-rice-soup-sopa-de-pollo-y-arroz/,"Total Fat 15g 19%, Saturated Fat 4g 18%, Cholesterol 65mg 22%, Sodium 957mg 42%, Total Carbohydrate 26g 10%, Dietary Fiber 4g 13%, Total Sugars 3g, Protein 22g, Vitamin C 12mg 59%, Calcium 49mg 4%, Iron 2mg 12%, Potassium 450mg 10%",8.471982087173686,2.727503028589589,7.563024692866637,7.4635133246822365,5.768693698011439
Easy Arugula Salad,"4 cups young arugula leaves, rinsed and dried, 1 cup cherry tomatoes, halved, ¼ cup pine nuts, 2 tablespoons grapeseed oil or olive oil, 1 tablespoon rice vinegar,   salt to taste,   freshly ground black pepper to taste, ¼ cup grated Parmesan cheese, 1 large avocado - peeled, pitted and sliced",https://www.allrecipes.com/recipe/71600/easy-arugula-salad/,"Total Fat 23g 30%, Saturated Fat 4g 19%, Cholesterol 4mg 1%, Sodium 381mg 17%, Total Carbohydrate 10g 4%, Dietary Fiber 6g 21%, Total Sugars 1g, Protein 6g, Vitamin C 17mg 87%, Calcium 101mg 8%, Iron 2mg 9%, Potassium 560mg 12%",7.469370980804563,1.0,7.922297369766297,4.746652263348457,6.512897492068117
California Roll Sushi,"1 cup uncooked short-grain white rice, 1 cup water, ¼ cup rice vinegar, 1 tablespoon white sugar, ½ cup imitation crabmeat, finely chopped, ¼ cup mayonnaise, 8 sheets nori (dry seaweed), 2 ½ tablespoons sesame seeds, 1  cucumber, cut into thin spears, 2  avocados - pitted, peeled, and sliced the long way",https://www.allrecipes.com/recipe/189477/california-roll-sushi/,"Total Fat 14g 18%, Saturated Fat 2g 11%, Cholesterol 5mg 2%, Sodium 135mg 6%, Total Carbohydrate 24g 9%, Dietary Fiber 4g 16%, Total Sugars 3g, Protein 4g, Vitamin C 7mg 34%, Calcium 43mg 3%, Iron 2mg 9%, Potassium 327mg 7%",6.339914794587111,2.727503028589589,7.181255410056294,3.8988058916159996,5.640421290136032
Avocado Shrimp Ceviche-Estillo Sarita,"2 pounds large shrimp - peeled, deveined and chopped, ¾ cup fresh lime juice, 5  roma (plum) tomatoes, diced, 1  white onion, chopped, ½ cup chopped fresh cilantro, 1 tablespoon Worcestershire sauce, 1 tablespoon ketchup, 1 teaspoon hot pepper sauce,   salt and pepper to taste, 1  avocado - peeled, pitted and diced, 16  saltine crackers",https://www.allrecipes.com/recipe/90396/avocado-shrimp-ceviche-estillo-sarita/,"Total Fat 11g 14%, Saturated Fat 2g 9%, Cholesterol 346mg 115%, Sodium 691mg 30%, Total Carbohydrate 24g 9%, Dietary Fiber 6g 20%, Total Sugars 6g, Protein 41g, Vitamin C 38mg 191%, Calcium 113mg 9%, Iron 7mg 39%, Potassium 943mg 20%",8.117462558362647,3.817436088711564,8.52766004563479,8.765251657813007,5.270249499695429
Avocado Toast (Vegan),"4 slices whole-grain bread, 1  avocado, halved and pitted, 2 tablespoons chopped fresh parsley, 1 ½ teaspoons extra-virgin olive oil, ½  lemon, juiced, ½ teaspoon salt, ½ teaspoon ground black pepper, ½ teaspoon onion powder, ½ teaspoon garlic powder",https://www.allrecipes.com/recipe/246803/avocado-toast-vegan/,"Total Fat 10g 13%, Saturated Fat 2g 8%, Sodium 430mg 19%, Total Carbohydrate 17g 6%, Dietary Fiber 6g 20%, Total Sugars 2g, Protein 5g, Vitamin C 8mg 39%, Calcium 42mg 3%, Iron 1mg 7%, Potassium 334mg 7%",7.60107696502529,2.089933060121975,7.198376401702814,4.3654094206841,5.048233143158925
Quesadillas I,"10 (6 inch) corn tortillas, 2 cups shredded mozzarella cheese, 1 (2 ounce) can sliced black olives, 2  avocados - peeled, pitted and sliced, 2 teaspoons hot pepper sauce",https://www.allrecipes.com/recipe/14847/quesadillas-i/,"Total Fat 25g 31%, Saturated Fat 8g 40%, Cholesterol 35mg 12%, Sodium 457mg 20%, Total Carbohydrate 32g 12%, Dietary Fiber 9g 32%, Total Sugars 2g, Protein 15g, Vitamin C 10mg 48%, Calcium 288mg 22%, Iron 2mg 9%, Potassium 524mg 11%",7.667371131777758,2.089933060121975,8.185415446390952,6.6626587382245575,6.661646729339365
Avocado Toast with Egg,"1 teaspoon butter, 2  eggs, 2 slices multigrain bread, 1  ripe avocado, pitted, peeled, 1 teaspoon lemon juice, or to taste, 1 pinch cayenne pepper,   sea salt to taste,   ground black pepper to taste",https://www.allrecipes.com/recipe/265304/avocado-toast-with-egg/,"Total Fat 23g 29%, Saturated Fat 5g 26%, Cholesterol 191mg 64%, Sodium 361mg 16%, Total Carbohydrate 21g 8%, Dietary Fiber 9g 31%, Total Sugars 3g, Protein 12g, Vitamin C 12mg 58%, Calcium 69mg 5%, Iron 4mg 23%, Potassium 628mg 13%",7.410671767348048,2.727503028589589,7.993766072470818,6.196055209156457,6.5271315533234375
"Kale, Quinoa, and Avocado Salad with Lemon Dijon Vinaigrette","⅔ cup quinoa, 1 ⅓ cups water, 1 bunch kale, torn into bite-sized pieces, ½  avocado - peeled, pitted, and diced, ½ cup chopped cucumber, ⅓ cup chopped red bell pepper, 2 tablespoons chopped red onion, 1 tablespoon crumbled feta cheese",https://www.allrecipes.com/recipe/230050/kale-quinoa-and-avocado-salad-with-lemon-dijon-vinaigrette/,"Total Fat 20g 26%, Saturated Fat 3g 16%, Cholesterol 2mg 1%, Sodium 552mg 24%, Total Carbohydrate 35g 13%, Dietary Fiber 6g 23%, Total Sugars 1g, Protein 9g, Vitamin C 157mg 786%, Calcium 188mg 14%, Iron 8mg 42%, Potassium 856mg 18%",7.872970453529668,1.0,8.514321130582783,5.594498635080916,6.267048552432353
Awesome Turkey Sandwich,"2 slices whole wheat bread, toasted (Optional), 1 tablespoon mayonnaise, 2 teaspoons Dijon-style prepared mustard, 3 slices smoked turkey breast, 2 tablespoons guacamole, ½ cup mixed salad greens, ¼ cup bean sprouts, ¼  avocado - peeled, pitted and sliced, 3 ounces Colby-Monterey Jack cheese, sliced, 2 slices tomato",https://www.allrecipes.com/recipe/34400/awesome-turkey-sandwich/,"Total Fat 57g 73%, Saturated Fat 25g 124%, Cholesterol 124mg 41%, Sodium 1988mg 86%, Total Carbohydrate 41g 15%, Dietary Fiber 9g 31%, Total Sugars 3g, Protein 38g, Vitamin C 22mg 111%, Calcium 94mg 7%, Iron 4mg 21%, Potassium 928mg 20%",9.267841728407102,2.727503028589589,8.482230020020783,8.606361597371984,8.112011325472206
Grilled Avocados,"¼ cup olive oil, or as needed, 1 pinch ground chipotle pepper, or more to taste, 1 pinch chili powder, or more to taste , 4  avocados, halved and pitted",https://www.allrecipes.com/recipe/238173/grilled-avocados/,"Total Fat 22g 28%, Saturated Fat 3g 16%, Sodium 8mg 0%, Total Carbohydrate 9g 3%, Dietary Fiber 7g 24%, Total Sugars 1g, Protein 2g, Vitamin C 10mg 51%, Calcium 13mg 1%, Iron 1mg 3%, Potassium 490mg 10%",3.263693912052385,1.0,7.570680496056141,2.449402945808,6.43443998863271
Taco Salad III,"16 ounces lean ground beef, 1 (1.25 ounce) package taco seasoning mix, 1 head iceberg lettuce, shredded, 1  red onion, sliced, 1 bunch green onions, chopped, 1 (15 ounce) can pinto beans, drained, 1 (15 ounce) can kidney beans, drained, 2 large tomatoes, chopped, 1  avocados - peeled, pitted, and cubed, 8 ounces shredded Cheddar cheese, 1 (16 ounce) package corn chips, 1 (16 ounce) bottle Catalina salad dressing",https://www.allrecipes.com/recipe/16848/taco-salad-iii/,"Total Fat 61g 78%, Saturated Fat 16g 80%, Cholesterol 72mg 24%, Sodium 1682mg 73%, Total Carbohydrate 76g 28%, Dietary Fiber 12g 43%, Total Sugars 18g, Protein 27g, Vitamin C 17mg 84%, Calcium 376mg 29%, Iron 4mg 23%, Potassium 764mg 16%",9.085885973041778,5.544939117301153,8.621829938055,7.891747952621373,8.229505350143603
Vegetarian Tortilla Soup,"2 tablespoons vegetable oil, 1 (1 pound) package frozen pepper and onion stir fry mix, 2 cloves garlic, minced, 3 tablespoons ground cumin, 1 (28 ounce) can crushed tomatoes, 3 (4 ounce) cans chopped green chile peppers, drained, 4 (14 ounce) cans vegetable broth,   salt and pepper to taste, 1 (11 ounce) can whole kernel corn, 12 ounces tortilla chips, 1 cup shredded Cheddar cheese, 1  avocado - peeled, pitted and diced",https://www.allrecipes.com/recipe/80743/vegetarian-tortilla-soup/,"Total Fat 16g 21%, Saturated Fat 4g 20%, Cholesterol 12mg 4%, Sodium 1152mg 50%, Total Carbohydrate 37g 14%, Dietary Fiber 6g 21%, Total Sugars 4g, Protein 9g, Vitamin C 27mg 136%, Calcium 186mg 14%, Iron 3mg 18%, Potassium 461mg 10%",8.673865770598102,3.179866120243951,7.896903604808404,5.594498635080916,5.875876521888666
Easy Keto Beef Tacos,"2 cups shredded Cheddar cheese, 1 pound ground beef, ½ package taco seasoning mix, ½ teaspoon salt, ¼ teaspoon ground black pepper, 1  avocado, diced, 1 cup shredded lettuce, ½ cup shredded Cheddar cheese, ½ cup tomatoes, diced",https://www.allrecipes.com/recipe/261032/easy-keto-beef-tacos/,"Total Fat 53g 67%, Saturated Fat 26g 128%, Cholesterol 157mg 52%, Sodium 1197mg 52%, Total Carbohydrate 10g 4%, Dietary Fiber 4g 14%, Total Sugars 2g, Protein 41g, Vitamin C 8mg 42%, Calcium 619mg 48%, Iron 3mg 16%, Potassium 634mg 13%",8.715579941493926,2.089933060121975,8.741602302171726,8.765251657813007,7.985471056279255
Turkey Avocado Panini,"½  ripe avocado, ¼ cup mayonnaise, 2  ciabatta rolls, 1 tablespoon olive oil, divided, 2 slices provolone cheese, 1 cup whole fresh spinach leaves, divided, ¼ pound thinly sliced mesquite smoked turkey breast, 2  roasted red peppers, sliced into strips",https://www.allrecipes.com/recipe/201117/turkey-avocado-panini/,"Total Fat 51g 66%, Saturated Fat 13g 63%, Cholesterol 62mg 21%, Sodium 1720mg 75%, Total Carbohydrate 42g 15%, Dietary Fiber 6g 21%, Total Sugars 4g, Protein 25g, Vitamin C 59mg 297%, Calcium 328mg 25%, Iron 4mg 23%, Potassium 623mg 13%",9.11020623972688,3.179866120243951,8.390271026260201,7.730818841368199,7.9147782118556504
Corn and Avocado Salsa,"3 ears fresh corn, husks and silks removed, 2  avocados - peeled, pitted, and cubed, 1  red onion, finely diced, 1  red bell pepper, seeded and diced, 1 tablespoon minced garlic, 1 tablespoon ground cumin, 1 teaspoon crushed red pepper flakes, ¼ cup chopped fresh cilantro, ⅓ cup red wine vinegar, 2 tablespoons olive oil, ¼ cup fresh lime juice,   salt and black pepper to taste",https://www.allrecipes.com/recipe/74692/corn-and-avocado-salsa/,"Total Fat 23g 29%, Saturated Fat 3g 17%, Sodium 65mg 3%, Total Carbohydrate 29g 11%, Dietary Fiber 10g 36%, Total Sugars 6g, Protein 5g, Vitamin C 62mg 308%, Calcium 46mg 4%, Iron 2mg 13%, Potassium 856mg 18%",5.544265784830916,3.817436088711564,8.319893490898448,4.3654094206841,6.512591757728502
Harvest Salad,"½ cup chopped walnuts, 1 bunch spinach, rinsed and torn into bite-size pieces, ½ cup dried cranberries, ½ cup crumbled blue cheese, 2  tomatoes, chopped, 1  avocado - peeled, pitted and diced, ½  red onion, thinly sliced, 2 tablespoons red raspberry jam (with seeds), 2 tablespoons red wine vinegar, ⅓ cup walnut oil,   freshly ground black pepper to taste,   salt to taste",https://www.allrecipes.com/recipe/23783/harvest-salad/,"Total Fat 27g 35%, Saturated Fat 5g 23%, Cholesterol 8mg 3%, Sodium 207mg 9%, Total Carbohydrate 22g 8%, Dietary Fiber 5g 19%, Total Sugars 13g, Protein 7g, Vitamin C 25mg 127%, Calcium 136mg 10%, Iron 2mg 12%, Potassium 670mg 14%",6.80523319604855,5.033231585790421,8.175928276912876,5.068988493958879,6.79501507884556
Warm Shrimp Salad,"1 pound medium shrimp - peeled and deveined, 2 tablespoons butter, 2  lemons, juiced, 2 heads butter lettuce, 2  tomatoes, chopped, 1  avocado - peeled, pitted and diced, 2 stalks celery, chopped, 1  cucumber, cleaned and chopped, ½ cup shredded carrots, ⅓ cup vinaigrette salad dressing",https://www.allrecipes.com/recipe/14189/warm-shrimp-salad/,"Total Fat 26g 33%, Saturated Fat 7g 37%, Cholesterol 250mg 83%, Sodium 566mg 25%, Total Carbohydrate 29g 11%, Dietary Fiber 12g 43%, Total Sugars 9g, Protein 37g, Vitamin C 90mg 449%, Calcium 218mg 17%, Iron 7mg 37%, Potassium 1474mg 31%",7.900235730699399,4.455006057179178,9.129008160319472,8.550597054191998,6.744966298029247
Avocado Soup with Chicken and Lime,"4 (6 inch) corn tortillas, julienned, 1 ½ tablespoons olive oil, 1  white onion, sliced thinly, 8 cloves garlic, thinly sliced, 4  fresh jalapeno peppers, sliced, 8 ounces skinless, boneless chicken breast halves - cut into thin strips, 1 quart chicken broth, ¼ cup fresh lime juice, 1  tomato, seeded and diced,   salt and ground black pepper to taste, 1  avocado - peeled, pitted and diced, ¼ cup chopped fresh cilantro",https://www.allrecipes.com/recipe/20809/avocado-soup-with-chicken-and-lime/,"Total Fat 15g 20%, Saturated Fat 2g 12%, Cholesterol 37mg 12%, Sodium 1048mg 46%, Total Carbohydrate 25g 9%, Dietary Fiber 7g 23%, Total Sugars 4g, Protein 17g, Vitamin C 24mg 122%, Calcium 59mg 5%, Iron 1mg 8%, Potassium 590mg 13%",8.570866188542233,3.179866120243951,7.896903604808404,6.924380682988979,5.765422983571707
Meyer Lemon Avocado Toast,"2 slices whole grain bread, ½  avocado, 2 tablespoons chopped fresh cilantro, or more to taste, 1 teaspoon Meyer lemon juice, or to taste, ¼ teaspoon Meyer lemon zest, 1 pinch cayenne pepper, 1 pinch fine sea salt, ¼ teaspoon chia seeds",https://www.allrecipes.com/recipe/257457/meyer-lemon-avocado-toast/,"Total Fat 1g 2%, Saturated Fat 0g 1%, Sodium 271mg 12%, Total Carbohydrate 12g 4%, Dietary Fiber 2g 8%, Total Sugars 2g, Protein 4g, Vitamin C 3mg 13%, Calcium 31mg 2%, Iron 3mg 14%, Potassium 82mg 2%",7.098503860404261,2.089933060121975,5.6869361520890545,3.8988058916159996,1.0
Mexican Baked Fish,"1 ½ pounds cod, 1 cup salsa, 1 cup shredded sharp Cheddar cheese, ½ cup coarsely crushed corn chips, 1  avocado - peeled, pitted and sliced, ¼ cup sour cream",https://www.allrecipes.com/recipe/12745/mexican-baked-fish/,"Total Fat 18g 23%, Saturated Fat 7g 36%, Cholesterol 69mg 23%, Sodium 529mg 23%, Total Carbohydrate 11g 4%, Dietary Fiber 3g 12%, Total Sugars 2g, Protein 28g, Vitamin C 7mg 34%, Calcium 213mg 16%, Iron 1mg 5%, Potassium 717mg 15%",7.826639773812026,2.089933060121975,8.357632745439155,7.967794385574878,6.088362354810509
Easy Never Forgotten Guacamole,"3  avocados - peeled, pitted and diced, 1 tablespoon sour cream, 2 (3 ounce) packages cream cheese, softened, 2 tablespoons salsa, 1 pinch salt, 1 dash ground black pepper, 1 dash garlic salt, 1 dash onion powder",https://www.allrecipes.com/recipe/22972/easy-never-forgotten-guacamole/,"Total Fat 9g 12%, Saturated Fat 3g 17%, Cholesterol 12mg 4%, Sodium 67mg 3%, Total Carbohydrate 4g 1%, Dietary Fiber 3g 9%, Total Sugars 0g, Protein 2g, Vitamin C 4mg 19%, Calcium 15mg 1%, Iron 0mg 2%, Potassium 204mg 4%",5.577256390135347,0.0,6.501841598105232,2.449402945808,4.865338759020483
Avocado Dressing,"1  avocado, peeled and pitted, ½ cup plain yogurt, ¼ cup extra-virgin olive oil, 3 tablespoons lemon juice, 2 cloves garlic, 1 teaspoon sea salt, ¼ teaspoon hot pepper sauce, ⅛ teaspoon ground black pepper",https://www.allrecipes.com/recipe/241148/avocado-dressing/,"Total Fat 7g 9%, Saturated Fat 1g 6%, Cholesterol 1mg 0%, Sodium 158mg 7%, Total Carbohydrate 3g 1%, Dietary Fiber 1g 4%, Total Sugars 1g, Protein 1g, Vitamin C 4mg 19%, Calcium 22mg 2%, Iron 2mg 11%, Potassium 113mg 2%",6.511174671537975,1.0,5.900306183524765,1.0,4.421405037625378
Avocado Egg Salad,"6  hard-boiled eggs, peeled, 2  avocados - peeled, pitted, and cubed, ½ cup minced red onion, 3 tablespoons chopped sweet pickles, 1 tablespoon prepared yellow mustard, ⅓ cup mayonnaise,   salt and pepper to taste",https://www.allrecipes.com/recipe/170446/avocado-egg-salad/,"Total Fat 25g 32%, Saturated Fat 5g 23%, Cholesterol 217mg 72%, Sodium 189mg 8%, Total Carbohydrate 9g 3%, Dietary Fiber 5g 18%, Total Sugars 3g, Protein 8g, Vitamin C 8mg 39%, Calcium 42mg 3%, Iron 1mg 6%, Potassium 418mg 9%",6.706200712391172,2.727503028589589,7.456323403280557,5.348208837423999,6.674381753079587
Absolutely Amazing Ahi,"¾ pound sashimi grade tuna steak, diced, ½ cup diced cucumber, 1  avocados - peeled, pitted and diced, ¼ cup chopped green onion, 1 ½ teaspoons red pepper flakes, 1 tablespoon toasted sesame seeds, 1 ½ teaspoons lemon juice, 2 teaspoons sesame oil, ½ cup soy sauce",https://www.allrecipes.com/recipe/33247/absolutely-amazing-ahi/,"Total Fat 8g 10%, Saturated Fat 1g 6%, Cholesterol 26mg 9%, Sodium 1227mg 53%, Total Carbohydrate 6g 2%, Dietary Fiber 3g 11%, Total Sugars 1g, Protein 16g, Vitamin C 6mg 31%, Calcium 38mg 3%, Iron 1mg 8%, Potassium 513mg 11%",8.74252702680404,1.0,7.687337539538623,6.797611783231999,4.661623458840709
Quick and Easy Guacamole,"2  avocados - peeled, pitted, and diced, 2  green onions, chopped, 1 tablespoon chopped fresh cilantro, 1 teaspoon seasoned salt, 1 teaspoon ground black pepper, 1 teaspoon garlic, minced, ½  lime, juiced",https://www.allrecipes.com/recipe/223271/quick-and-easy-guacamole/,"Total Fat 15g 19%, Saturated Fat 2g 11%, Sodium 238mg 10%, Total Carbohydrate 10g 4%, Dietary Fiber 7g 25%, Total Sugars 1g, Protein 2g, Vitamin C 14mg 68%, Calcium 27mg 2%, Iron 1mg 5%, Potassium 532mg 11%",6.9571503025210735,1.0,7.705788839532031,2.449402945808,5.761091614288717
