recipe_name,ingredients,url,nutrition,salt_score,sweet_score,bitter_score,umami_score,richness_score
Air-Fried Crumbed Fish,"1 cup dry bread crumbs, ¼ cup vegetable oil, 4  flounder fillets, 1  egg, beaten, 1  lemon, sliced",https://www.allrecipes.com/recipe/260624/air-fried-crumbed-fish/,"Total Fat 18g 23%, Saturated Fat 3g 16%, Cholesterol 107mg 36%, Sodium 309mg 13%, Total Carbohydrate 23g 8%, Dietary Fiber 3g 9%, Total Sugars 2g, Protein 27g, Vitamin C 22mg 108%, Calcium 89mg 7%, Iron 2mg 11%, Potassium 415mg 9%",7.241353500011174,2.089933060121975,7.575759089725373,7.891747952621373,6.092055896747821
Mom's Peach Crisp,"4 cups sliced fresh peaches, ½ cup all-purpose flour, ½ cup brown sugar, ½ cup cold butter, 1 teaspoon ground cinnamon, ¼ teaspoon salt, 1 cup rolled oats",https://www.allrecipes.com/recipe/231532/moms-peach-crisp/,"Total Fat 12g 16%, Saturated Fat 7g 37%, Cholesterol 31mg 10%, Sodium 162mg 7%, Total Carbohydrate 31g 11%, Dietary Fiber 1g 5%, Total Sugars 17g, Protein 2g, Vitamin C 27mg 137%, Calcium 32mg 2%, Iron 1mg 6%, Potassium 89mg 2%",6.5383912556358705,5.455060882698847,5.751605815587405,2.449402945808,5.373313255018932
Peach Pie the Old Fashioned Two Crust Way,"1 (14.1 ounce) package pastry for a double-crust 9-inch pie, 1  egg, beaten, 5 cups sliced peeled peaches, 2 tablespoons lemon juice, 1 cup white sugar, ½ cup all-purpose flour, ½ teaspoon ground cinnamon, ¼ teaspoon ground nutmeg, ¼ teaspoon salt, 2 tablespoons butter",https://www.allrecipes.com/recipe/87979/peach-pie-the-old-fashioned-two-crust-way/,"Total Fat 20g 25%, Saturated Fat 6g 31%, Cholesterol 31mg 10%, Sodium 358mg 16%, Total Carbohydrate 59g 21%, Dietary Fiber 2g 8%, Total Sugars 30g, Protein 5g, Vitamin C 36mg 180%, Calcium 22mg 2%, Iron 2mg 11%, Potassium 81mg 2%",7.401587375322358,6.348182282555337,5.559176500503064,4.3654094206841,6.269595733161693
Peach Dump Cake,"2 (16 ounce) cans peaches in heavy syrup, 1 (18.25 ounce) package yellow cake mix, ½ cup butter, ½ teaspoon ground cinnamon, or to taste",https://www.allrecipes.com/recipe/7987/peach-cobbler-dump-cake-i/,"Total Fat 6g 8%, Saturated Fat 3g 14%, Cholesterol 11mg 4%, Sodium 171mg 7%, Total Carbohydrate 24g 9%, Dietary Fiber 1g 3%, Total Sugars 16g, Protein 1g, Vitamin C 1mg 6%, Calcium 32mg 2%, Iron 0mg 2%, Potassium 53mg 1%",6.597249192816562,5.359732240487902,5.288205715778672,1.0,4.153357960917753
Quick and Easy Peach Cobbler,"½ cup unsalted butter, melted, 1 cup self-rising flour, 1 cup white sugar, 1 cup milk, 2 (16 ounce) cans sliced peaches in heavy syrup",https://www.allrecipes.com/recipe/12386/quick-and-easy-peach-cobbler/,"Total Fat 8g 11%, Saturated Fat 5g 26%, Cholesterol 22mg 7%, Sodium 201mg 9%, Total Carbohydrate 39g 14%, Dietary Fiber 1g 3%, Total Sugars 31g, Protein 2g, Vitamin C 1mg 4%, Calcium 61mg 5%, Iron 1mg 3%, Potassium 110mg 2%",6.773213044706616,6.399742345024968,6.192056644311936,2.449402945808,4.660747025464866
Basic Fruit Smoothie,"1 quart strawberries, hulled, 2  fresh peaches - peeled, pitted, and sliced, 1  banana, broken into chunks, 2 cups ice, 1 cup orange-peach-mango juice",https://www.allrecipes.com/recipe/23553/basic-fruit-smoothie/,"Total Fat 1g 1%, Saturated Fat 0g 1%, Sodium 16mg 1%, Total Carbohydrate 29g 10%, Dietary Fiber 4g 14%, Total Sugars 20g, Protein 2g, Vitamin C 129mg 644%, Calcium 36mg 3%, Iron 1mg 4%, Potassium 443mg 9%",4.01825854940318,5.710612314087722,7.5081147595685085,2.449402945808,1.0
Old Fashioned Peach Cobbler,"2 ½ cups all-purpose flour, 4 tablespoons white sugar, divided, 1 teaspoon salt, 1 cup shortening, 1 large egg, ¼ cup cold water, 1 tablespoon butter, melted",https://www.allrecipes.com/recipe/19897/old-fashioned-peach-cobbler/,"Total Fat 18g 23%, Saturated Fat 7g 33%, Cholesterol 26mg 9%, Sodium 177mg 8%, Total Carbohydrate 44g 16%, Dietary Fiber 1g 2%, Total Sugars 30g, Protein 2g, Vitamin C 31mg 156%, Calcium 16mg 1%, Iron 1mg 5%, Potassium 69mg 1%",6.634791073777162,6.348182282555337,5.303204053132724,2.449402945808,6.0841734408705515
Classic Bisquick Peach Cobbler,"1 cup Original Bisquick® mix, 1 cup milk, ½ teaspoon ground nutmeg, ½ cup butter or margarine, melted, 1 (29 ounce) can sliced peaches, drained, 1 cup sugar",https://www.allrecipes.com/recipe/234261/classic-bisquick-peach-cobbler/,"Total Fat 19g 25%, Saturated Fat 11g 56%, Cholesterol 44mg 15%, Sodium 383mg 17%, Total Carbohydrate 63g 23%, Dietary Fiber 2g 8%, Total Sugars 50g, Protein 4g, Vitamin C 5mg 25%, Calcium 91mg 7%, Iron 1mg 6%, Potassium 266mg 6%",7.475070505134638,7.151425447809519,7.132063611020537,3.8988058916159996,6.180759450367478
3-Ingredient Cake Mix Cobbler,"2 (15.25 ounce) cans peaches in light syrup, 1 (15.25 ounce) package yellow cake mix, ½ cup butter, melted",https://www.allrecipes.com/recipe/264042/3-ingredient-cake-mix-cobbler/,"Total Fat 19g 24%, Saturated Fat 8g 42%, Cholesterol 32mg 11%, Sodium 512mg 22%, Total Carbohydrate 66g 24%, Dietary Fiber 2g 8%, Total Sugars 42g, Protein 4g, Vitamin C 3mg 14%, Calcium 94mg 7%, Iron 1mg 8%, Potassium 161mg 3%",7.791081736157157,6.8772650297582985,6.7020227037458175,3.8988058916159996,6.179651271751821
Easy Batter Fruit Cobbler,"4 tablespoons butter, ¾ cup all-purpose flour, ¾ cup sugar, 1 teaspoon baking powder, ¼ teaspoon salt, ¾ cup milk, 2 cups of sliced fresh peaches or nectarines, or whole blueberries, strawberries, raspberries, blackberries or a combination of fruits (or a 12-ounce package of frozen berries), 1 tablespoon sugar",https://www.allrecipes.com/recipe/88354/easy-batter-fruit-cobbler/,"Total Fat 13g 16%, Saturated Fat 8g 40%, Cholesterol 34mg 11%, Sodium 371mg 16%, Total Carbohydrate 65g 24%, Dietary Fiber 1g 2%, Total Sugars 47g, Protein 4g, Vitamin C 28mg 138%, Calcium 136mg 10%, Iron 1mg 7%, Potassium 119mg 3%",7.440416969249048,7.054130024828418,6.7020227037458175,3.8988058916159996,5.514094569779291
Peach Preserves,"12  fresh peaches, pitted and chopped, 4 ½ cups white sugar, 1 (2 ounce) package dry pectin",https://www.allrecipes.com/recipe/21351/peach-preserves/,"Sodium 1mg 0%, Total Carbohydrate 15g 6%, Total Sugars 15g, Vitamin C 8mg 39%, Calcium 2mg 0%, Potassium 6mg 0%",1.0,5.258249222433361,2.2577597478497538,1.0,0.0
Georgia Peach Homemade Ice Cream,"2 ½ pounds fresh peaches - peeled, pitted and chopped, 1 pint half-and-half cream, ½ cup white sugar, 1 (14 ounce) can sweetened condensed milk, 1 (12 fluid ounce) can evaporated milk, 1 teaspoon vanilla extract, 2 cups whole milk, or as needed",https://www.allrecipes.com/recipe/38236/georgia-peach-homemade-ice-cream/,"Total Fat 5g 6%, Saturated Fat 3g 14%, Cholesterol 16mg 5%, Sodium 42mg 2%, Total Carbohydrate 14g 5%, Total Sugars 13g, Protein 3g, Vitamin C 12mg 61%, Calcium 104mg 8%, Iron 0mg 1%, Potassium 135mg 3%",5.068852040599429,5.033231585790421,6.61390790914764,3.297249317540458,3.8352105561925414
Easy Peach Cobbler,"1 cup white sugar, ½ cup butter, room temperature, 1 cup self-rising flour, 1 cup milk, 1 (15 ounce) can peaches",https://www.allrecipes.com/recipe/19044/easy-peach-cobbler/,"Total Fat 16g 21%, Saturated Fat 10g 52%, Cholesterol 44mg 15%, Sodium 393mg 17%, Total Carbohydrate 59g 21%, Dietary Fiber 2g 5%, Total Sugars 43g, Protein 4g, Vitamin C 3mg 13%, Calcium 127mg 10%, Iron 1mg 7%, Potassium 182mg 4%",7.503128931061115,6.914265349124479,6.9474565968616435,3.8988058916159996,5.879386630996783
Peach Muffins,"3 cups all-purpose flour, 1 tablespoon ground cinnamon, 1 teaspoon baking soda, 1 teaspoon salt, 1 ¼ cups vegetable oil, 3  eggs, lightly beaten, 2 cups white sugar, 2 cups peeled, pitted, and chopped peaches",https://www.allrecipes.com/recipe/74658/peach-muffins/,"Total Fat 18g 23%, Saturated Fat 3g 15%, Cholesterol 35mg 12%, Sodium 238mg 10%, Total Carbohydrate 44g 16%, Dietary Fiber 1g 3%, Total Sugars 26g, Protein 4g, Vitamin C 7mg 35%, Calcium 15mg 1%, Iron 1mg 7%, Potassium 45mg 1%",6.9571503025210735,6.123164645912397,4.862753224408192,3.8988058916159996,6.085051016543345
Peach Pie with Frozen Peaches,"2 sheets refrigerated pie crust, 2 teaspoons all-purpose flour, or as needed, 2 pounds sliced frozen peaches, ½ cup white sugar, 1 teaspoon lemon juice, ½ teaspoon ground cinnamon, ⅛ teaspoon salt, 3 tablespoons cornstarch, 1 large egg, beaten, 1 tablespoon white sugar, 1 tablespoon coarse sparkling sugar",https://www.allrecipes.com/recipe/284448/peach-pie-with-frozen-peaches/,"Total Fat 17g 22%, Saturated Fat 4g 22%, Cholesterol 23mg 8%, Sodium 304mg 13%, Total Carbohydrate 47g 17%, Dietary Fiber 2g 7%, Total Sugars 19g, Protein 4g, Vitamin C 37mg 185%, Calcium 20mg 2%, Iron 2mg 9%, Potassium 71mg 2%",7.223594433077205,5.629956633903902,5.4035502276978695,3.8988058916159996,5.983521136990223
Award Winning Peaches and Cream Pie,"¾ cup all-purpose flour, ½ teaspoon salt, 1 teaspoon baking powder, 1 (3 ounce) package non-instant vanilla pudding mix, 3 tablespoons butter, softened, 1  egg, ½ cup milk, 1 (29 ounce) can sliced peaches, drained and syrup reserved, 1 (8 ounce) package cream cheese, softened, ½ cup white sugar, 1 tablespoon white sugar, 1 teaspoon ground cinnamon",https://www.allrecipes.com/recipe/15142/award-winning-peaches-and-cream-pie/,"Total Fat 15g 19%, Saturated Fat 9g 47%, Cholesterol 67mg 22%, Sodium 422mg 18%, Total Carbohydrate 54g 20%, Dietary Fiber 1g 5%, Total Sugars 42g, Protein 6g, Vitamin C 1mg 5%, Calcium 84mg 6%, Iron 1mg 6%, Potassium 169mg 4%",7.580633046627151,6.8772650297582985,6.691965058263253,4.746652263348457,5.7689270878054275
"Peaches and Cream, Literally","4  fresh peaches, or as needed, ⅓ cup white sugar, or to taste, ¼ cup water, 1 ½ cups heavy cream",https://www.allrecipes.com/recipe/274821/peaches-and-cream-literally/,"Total Fat 33g 42%, Saturated Fat 21g 103%, Cholesterol 122mg 41%, Sodium 38mg 2%, Total Carbohydrate 25g 9%, Total Sugars 23g, Protein 2g, Vitamin C 42mg 212%, Calcium 70mg 5%, Iron 0mg 1%, Potassium 100mg 2%",4.959900521024819,5.93037972541657,6.1770583069578855,2.449402945808,7.153786210643991
Nana's Southern Pickled Peaches,"4 cups white sugar, 1 cup white vinegar, 1 cup water, 2 tablespoons whole cloves, 4 pounds fresh clingstone peaches, blanched and peeled , 5 (3 inch) cinnamon sticks",https://www.allrecipes.com/recipe/72126/nanas-southern-pickled-peaches/,"Sodium 2mg 0%, Total Carbohydrate 23g 8%, Dietary Fiber 0g 1%, Protein 0g, Vitamin C 15mg 73%, Calcium 11mg 1%, Iron 0mg 1%, Potassium 14mg 0%",1.7545646373507955,0.0,3.7189055816570056,1.0,0.0
Blueberry and Peach Crisp,"2 (10 ounce) packages frozen sliced peaches(such as Cascadian Farm®), thawed and drained, 1 (10 ounce) package frozen blueberries(such as Cascadian Farm®), thawed and drained, 2 teaspoons lemon juice, 2 tablespoons all-purpose flour, 2 tablespoons white sugar",https://www.allrecipes.com/recipe/239090/blueberry-and-peach-crisp/,"Total Fat 8g 10%, Saturated Fat 4g 18%, Cholesterol 14mg 5%, Sodium 43mg 2%, Total Carbohydrate 38g 14%, Dietary Fiber 3g 11%, Total Sugars 28g, Protein 3g, Vitamin C 61mg 304%, Calcium 27mg 2%, Iron 1mg 6%, Potassium 164mg 3%",5.09446749680119,6.239695061290686,6.333115547075276,3.297249317540458,4.658992846905241
Easy Peach Cobbler with Canned Peaches,"2 (29 ounce) cans sliced peaches in juice, 2 cups all-purpose flour, 1 cup sugar, ¾ cup unsalted butter, softened, 1 cup chopped pecans",https://www.allrecipes.com/recipe/285159/easy-peach-cobbler-with-canned-peaches/,"Total Fat 14g 18%, Saturated Fat 6g 30%, Cholesterol 23mg 8%, Sodium 6mg 0%, Total Carbohydrate 37g 13%, Dietary Fiber 2g 9%, Total Sugars 23g, Protein 3g, Vitamin C 4mg 19%, Calcium 16mg 1%, Iron 1mg 7%, Potassium 177mg 4%",2.9505212919220636,5.93037972541657,6.3464041968263185,3.297249317540458,5.642679479092099
Butter Biscuit Peach Cobbler,"2 (29 ounce) cans peaches, ¾ cup white sugar, ½ cup brown sugar, ½ cup unsalted butter, 1 tablespoon cornstarch, 1 teaspoon vanilla extract, 1 teaspoon ground cinnamon, ½ teaspoon nutmeg, 1 pinch salt, 1 (16 ounce) can refrigerated buttermilk biscuit dough (such as Pillsbury Grands!®), 1 pinch ground cinnamon, 1 pinch white sugar, 1 pinch ground nutmeg, 1  pastry for a 9-inch pie crust",https://www.allrecipes.com/recipe/234306/butter-biscuit-peach-cobbler/,"Total Fat 21g 27%, Saturated Fat 9g 45%, Cholesterol 25mg 8%, Sodium 552mg 24%, Total Carbohydrate 73g 27%, Dietary Fiber 3g 12%, Total Sugars 46g, Protein 5g, Vitamin C 6mg 30%, Calcium 50mg 4%, Iron 2mg 12%, Potassium 313mg 7%",7.872970453529668,7.020312785538545,7.156895376089792,4.3654094206841,6.354743732944862
Easy Peach Cobbler with Cake Mix,"12  fresh peaches, pitted and sliced, 1 cup water, 1 cup white sugar, ½ teaspoon ground cinnamon, 1 (18.25 ounce) package white cake mix, 1 (8 ounce) package cream cheese, ½ cup butter",https://www.allrecipes.com/recipe/15046/easy-peach-cobbler-with-cake-mix/,"Total Fat 19g 24%, Saturated Fat 10g 49%, Cholesterol 41mg 14%, Sodium 397mg 17%, Total Carbohydrate 56g 21%, Dietary Fiber 0g 1%, Total Sugars 46g, Protein 3g, Vitamin C 42mg 210%, Calcium 112mg 9%, Iron 1mg 5%, Potassium 108mg 2%",7.5141528901833325,7.020312785538545,6.513499344078413,3.297249317540458,6.180482471191556
GA Peach Pound Cake,"1 cup butter or margarine, softened, 2 cups white sugar, 4  eggs, 1 teaspoon vanilla extract, 3 cups all-purpose flour, 1 teaspoon baking powder, ½ teaspoon salt, 2 cups fresh peaches, pitted and chopped",https://www.allrecipes.com/recipe/17635/ga-peach-pound-cake/,"Total Fat 13g 17%, Saturated Fat 8g 39%, Cholesterol 77mg 26%, Sodium 196mg 9%, Total Carbohydrate 44g 16%, Dietary Fiber 1g 2%, Total Sugars 26g, Protein 4g, Vitamin C 7mg 34%, Calcium 37mg 3%, Iron 1mg 8%, Potassium 52mg 1%",6.745790772056321,6.123164645912397,5.361502420539542,3.8988058916159996,5.5198851911197115
White Peachy Sangria,"4 (750 milliliter) bottles moscato wine, 4 (12 fluid ounce) cans or bottles lemon-lime soda (such as Sprite®), 1 cup brandy, 1 cup peach schnapps, 2  fresh peaches, pitted and sliced, 1 (16 ounce) package fresh strawberries, sliced, 2  mangos - peeled, seeded, and sliced, ½  fresh pineapple - peeled, cored, and cut into chunks, 1 (6 ounce) container fresh raspberries",https://www.allrecipes.com/recipe/223329/white-peachy-sangria/,"Total Fat 0g 0%, Sodium 24mg 1%, Total Carbohydrate 41g 15%, Dietary Fiber 2g 5%, Total Sugars 22g, Protein 1g, Vitamin C 30mg 148%, Calcium 23mg 2%, Iron 1mg 3%, Potassium 228mg 5%",4.459650566623654,5.860481950506044,6.681827904876928,1.0,0.0
Southern Peach Cobbler,"½ cup butter, 1 cup white sugar, ¾ cup self-rising flour, ¾ cup milk, 1 (29 ounce) can sliced peaches in light syrup",https://www.allrecipes.com/recipe/22778/southern-peach-cobbler/,"Total Fat 12g 16%, Saturated Fat 8g 38%, Cholesterol 32mg 11%, Sodium 245mg 11%, Total Carbohydrate 50g 18%, Dietary Fiber 2g 6%, Total Sugars 40g, Protein 3g, Vitamin C 3mg 13%, Calcium 73mg 6%, Iron 1mg 5%, Potassium 151mg 3%",6.988706328228037,6.800545374209698,6.536501633032775,3.297249317540458,5.37345938187897
Peach Ice Cream,"6 large eggs, beaten, 3 ½ cups white sugar, 10  fresh peaches, pitted and chopped, 4 cups heavy cream, 2 cups half-and-half cream, 2 teaspoons vanilla extract, ¾ teaspoon salt",https://www.allrecipes.com/recipe/20120/peach-ice-cream/,"Total Fat 14g 18%, Saturated Fat 8g 41%, Cholesterol 81mg 27%, Sodium 86mg 4%, Total Carbohydrate 25g 9%, Total Sugars 24g, Protein 2g, Vitamin C 13mg 67%, Calcium 44mg 3%, Iron 0mg 1%, Potassium 66mg 1%",5.849032134151985,5.997302208955516,5.618831127396833,2.449402945808,5.649936197927172
Crisp Peach Cobbler,"6 large  fresh peaches, pitted and cut into eighths, 1  lemon, zested and juiced",https://www.allrecipes.com/recipe/259043/crisp-peach-cobbler/,"Total Fat 13g 16%, Saturated Fat 8g 39%, Cholesterol 33mg 11%, Sodium 279mg 12%, Total Carbohydrate 62g 23%, Dietary Fiber 1g 3%, Total Sugars 45g, Protein 3g, Vitamin C 43mg 214%, Calcium 111mg 9%, Iron 1mg 7%, Potassium 105mg 2%",7.130174651454258,6.98575225102295,6.490076898840603,3.297249317540458,5.5139596769787085
Baked Peaches 'n Cream,"8 teaspoons brown sugar, 2 tablespoons butter, cut into 8 pieces, 1 pinch ground cinnamon, or more to taste, 4  ripe peaches, halved and pitted , 4 scoops vanilla ice cream",https://www.allrecipes.com/recipe/241994/baked-peaches-n-cream/,"Total Fat 8g 10%, Saturated Fat 5g 26%, Cholesterol 25mg 8%, Sodium 63mg 3%, Total Carbohydrate 17g 6%, Dietary Fiber 0g 1%, Total Sugars 16g, Protein 1g, Vitamin C 42mg 210%, Calcium 48mg 4%, Iron 0mg 1%, Potassium 85mg 2%",5.510244057819904,5.359732240487902,5.862308048608535,1.0,4.6614043914532814
Peach and Blackberry Cobbler,"4 cups peeled and sliced fresh peaches, 1 cup fresh blackberries, ¼ cup white sugar, 1 teaspoon ground cinnamon, 1 tablespoon lemon juice, ½ cup butter, melted, 1 ¼ cups all-purpose flour, 1 cup white sugar, 2 teaspoons baking powder, ½ teaspoon salt, 1 cup milk",https://www.allrecipes.com/recipe/223305/peach-and-blackberry-cobbler/,"Total Fat 8g 11%, Saturated Fat 5g 26%, Cholesterol 22mg 7%, Sodium 243mg 11%, Total Carbohydrate 36g 13%, Dietary Fiber 1g 4%, Total Sugars 25g, Protein 2g, Vitamin C 21mg 107%, Calcium 84mg 6%, Iron 1mg 4%, Potassium 83mg 2%",6.979783272856343,6.061492387687543,6.161882470368257,2.449402945808,4.660747025464866
Freezer Peach Pie Filling,"2 ½ cups sliced peaches, ¾ cup white sugar, 1 tablespoon cornstarch, 1 tablespoon MINUTE Tapioca, 1 dash Dash of nutmeg",https://www.allrecipes.com/recipe/75611/freezer-peach-pie-filling/,"Total Fat 0g 0%, Sodium 1mg 0%, Total Carbohydrate 31g 11%, Dietary Fiber 2g 5%, Total Sugars 28g, Protein 1g, Vitamin C 2mg 10%, Calcium 5mg 0%, Iron 1mg 4%, Potassium 171mg 4%",1.0,6.239695061290686,6.228802517407659,1.0,0.0
Peach Banana Smoothie,"1 cup plain yogurt, 1 (15.25 ounce) can peaches, 2  bananas, sliced, ¼ cup orange juice, ¼ cup white sugar, or to taste, 2 cubes  ice",https://www.allrecipes.com/recipe/232903/peach-banana-smoothie/,"Total Fat 1g 2%, Saturated Fat 1g 4%, Cholesterol 4mg 1%, Sodium 48mg 2%, Total Carbohydrate 44g 16%, Dietary Fiber 3g 11%, Total Sugars 36g, Protein 5g, Vitamin C 17mg 87%, Calcium 124mg 10%, Iron 1mg 3%, Potassium 524mg 11%",5.214215203974449,6.634872177423128,7.894929249952834,4.3654094206841,1.007018473654115
Peach Cake II,"3  egg, beaten, 1 ¾ cups white sugar, 1 cup vegetable oil, 2 cups all-purpose flour, 1 teaspoon salt, 1 teaspoon ground cinnamon, 1 teaspoon baking soda, 2 cups fresh peaches - peeled, pitted, and sliced, ½ cup chopped pecans",https://www.allrecipes.com/recipe/8249/peach-cake-ii/,"Total Fat 12g 15%, Saturated Fat 2g 8%, Cholesterol 23mg 8%, Sodium 159mg 7%, Total Carbohydrate 24g 9%, Dietary Fiber 1g 2%, Total Sugars 15g, Protein 2g, Vitamin C 5mg 23%, Calcium 9mg 1%, Iron 1mg 4%, Potassium 33mg 1%",6.51804287514295,5.258249222433361,4.414351461953511,2.449402945808,5.372143802699745
Peach Upside Down Cake I,"¼ cup butter, ½ cup packed light brown sugar, ¼ teaspoon ground nutmeg, 5  fresh peaches - peeled, pitted and halved, ½ cup butter, softened, ½ cup white sugar, 1  egg, 1 ¼ cups all-purpose flour, 2 teaspoons baking powder, ½ teaspoon salt, ½ cup milk",https://www.allrecipes.com/recipe/7446/peach-upside-down-cake-i/,"Total Fat 16g 21%, Saturated Fat 10g 51%, Cholesterol 62mg 21%, Sodium 366mg 16%, Total Carbohydrate 41g 15%, Dietary Fiber 1g 2%, Total Sugars 27g, Protein 3g, Vitamin C 23mg 117%, Calcium 103mg 8%, Iron 1mg 6%, Potassium 86mg 2%",7.425645960263022,6.182509085768766,6.319687746629575,3.297249317540458,5.881357992050496
Peach Pie,"10  fresh peaches, pitted and sliced, ⅓ cup all-purpose flour, 1 cup white sugar, ¼ cup butter, 1 recipe pastry for a 9 inch double crust pie",https://www.allrecipes.com/recipe/12347/peach-pie/,"Total Fat 21g 27%, Saturated Fat 7g 37%, Cholesterol 15mg 5%, Sodium 280mg 12%, Total Carbohydrate 57g 21%, Dietary Fiber 2g 6%, Total Sugars 33g, Protein 3g, Vitamin C 52mg 262%, Calcium 22mg 2%, Iron 2mg 9%, Potassium 77mg 2%",7.134069491603057,6.498051918973657,5.509370503375237,3.297249317540458,6.35390732697498
Best Peach Cobbler Ever,"1 (29 ounce) can sliced peaches, 2 tablespoons butter, melted, 1 pinch ground cinnamon, 1 pinch ground nutmeg, 1 tablespoon cornstarch, ½ cup water, 1 cup milk, 1 cup white sugar, 1 cup all-purpose flour, 2 teaspoons baking powder, 1 pinch salt, ½ cup butter, 1 teaspoon ground cinnamon, ¼ teaspoon ground nutmeg",https://www.allrecipes.com/recipe/12320/best-peach-cobbler-ever/,"Total Fat 7g 9%, Saturated Fat 4g 22%, Cholesterol 18mg 6%, Sodium 138mg 6%, Total Carbohydrate 48g 18%, Dietary Fiber 2g 7%, Total Sugars 33g, Protein 1g, Vitamin C 2mg 10%, Calcium 51mg 4%, Iron 0mg 2%, Potassium 128mg 3%",6.363841178828077,6.498051918973657,6.243211019841324,1.0,4.42566898584054
Peach Cobbler VI,"1 cup all-purpose flour, ½ cup brown sugar, ½ cup white sugar, 2 teaspoons baking powder, ½ teaspoon salt, 1 teaspoon vanilla extract, ¾ cup milk, ½ cup margarine, melted, 1 (29 ounce) can sliced canned peaches, drained, 1 teaspoon ground cinnamon",https://www.allrecipes.com/recipe/18469/peach-cobbler-vi/,"Total Fat 12g 15%, Saturated Fat 2g 12%, Cholesterol 2mg 1%, Sodium 383mg 17%, Total Carbohydrate 47g 17%, Dietary Fiber 2g 7%, Total Sugars 33g, Protein 3g, Vitamin C 4mg 19%, Calcium 100mg 8%, Iron 1mg 7%, Potassium 201mg 4%",7.475070505134638,6.498051918973657,6.91392937404432,3.297249317540458,5.36907028419577
Easy Stovetop Peach Cobbler,"1 (29 ounce) can sliced peaches, 2 teaspoons ground cinnamon (Optional), ¼ cup white sugar, 1 (9 ounce) package yellow cake mix, 4 teaspoons margarine",https://www.allrecipes.com/recipe/139349/easy-stovetop-peach-cobbler/,"Total Fat 7g 9%, Saturated Fat 1g 6%, Cholesterol 1mg 0%, Sodium 311mg 14%, Total Carbohydrate 57g 21%, Dietary Fiber 3g 9%, Total Sugars 41g, Protein 3g, Vitamin C 5mg 25%, Calcium 74mg 6%, Iron 1mg 6%, Potassium 213mg 5%",7.248376793148663,6.839373051156013,6.853060981583949,3.297249317540458,4.421405037625378
Single Crust Peach Pie,"¾ cup white sugar, 2 tablespoons butter, softened, ⅓ cup all-purpose flour, ¼ teaspoon ground nutmeg, 6  fresh peaches - pitted, skinned, and sliced, 1 recipe pastry for a 9 inch single crust pie",https://www.allrecipes.com/recipe/12307/single-crust-peach-pie/,"Total Fat 10g 13%, Saturated Fat 4g 19%, Cholesterol 8mg 3%, Sodium 140mg 6%, Total Carbohydrate 38g 14%, Dietary Fiber 1g 4%, Total Sugars 23g, Protein 2g, Vitamin C 31mg 157%, Calcium 13mg 1%, Iron 1mg 5%, Potassium 46mg 1%",6.379504854252262,5.93037972541657,4.84155698603087,2.449402945808,5.049639081111123
Fresh Peach Cobbler I,"½ cup white sugar, 1 tablespoon cornstarch, ¼ teaspoon ground cinnamon, 4 cups sliced fresh peaches, 1 teaspoon lemon juice",https://www.allrecipes.com/recipe/15148/fresh-peach-cobbler-i/,"Total Fat 7g 9%, Saturated Fat 2g 10%, Cholesterol 2mg 1%, Sodium 328mg 14%, Total Carbohydrate 43g 15%, Dietary Fiber 1g 2%, Total Sugars 25g, Protein 3g, Vitamin C 37mg 185%, Calcium 106mg 8%, Iron 1mg 7%, Potassium 83mg 2%",7.306313197505055,6.061492387687543,6.319687746629575,3.297249317540458,4.421656144576533
Marie's Peach Dump Cake,"1 (29 ounce) can sliced peaches in heavy syrup, undrained, 1 (18.25 ounce) box yellow cake mix, ¾ cup butter, sliced into pats, or more if needed",https://www.allrecipes.com/recipe/229004/peach-dump-cake/,"Total Fat 17g 21%, Saturated Fat 8g 40%, Cholesterol 31mg 10%, Sodium 368mg 16%, Total Carbohydrate 42g 15%, Dietary Fiber 1g 5%, Total Sugars 26g, Protein 2g, Vitamin C 3mg 13%, Calcium 66mg 5%, Iron 1mg 4%, Potassium 125mg 3%",7.431578436309193,6.123164645912397,6.333115547075276,2.449402945808,5.984347178147385
Peachy Bread Pudding with Caramel Sauce,"2 cups fresh peaches - peeled, pitted and halved, 1 (14 ounce) can sweetened condensed milk, 3  eggs, lightly beaten, 1 ¼ cups hot water, ¼ cup butter, melted, 1 teaspoon ground cinnamon, 1 teaspoon vanilla extract, 4 cups French bread, torn into small pieces",https://www.allrecipes.com/recipe/174599/peachy-bread-pudding-with-caramel-sauce/,"Total Fat 20g 25%, Saturated Fat 12g 58%, Cholesterol 106mg 35%, Sodium 450mg 20%, Total Carbohydrate 61g 22%, Dietary Fiber 1g 4%, Total Sugars 36g, Protein 10g, Vitamin C 12mg 61%, Calcium 158mg 12%, Iron 2mg 11%, Potassium 249mg 5%",7.6505676082399425,6.634872177423128,7.302848864001904,5.8148123664921005,6.276166206895897
Peach and Tomato Caprese Salad,"2 tablespoons extra-virgin olive oil, 1 tablespoon balsamic vinegar, 1 teaspoon flaked salt, divided, 2 large heirloom tomatoes, thinly sliced, 2  ripe peaches - halved, pitted, and sliced into half moons, 6 leaves fresh basil, 1 (8 ounce) ball fresh mozzarella, thinly sliced",https://www.allrecipes.com/recipe/258123/peach-and-tomato-caprese-salad/,"Total Fat 19g 24%, Saturated Fat 9g 46%, Cholesterol 45mg 15%, Sodium 569mg 25%, Total Carbohydrate 8g 3%, Dietary Fiber 1g 4%, Total Sugars 7g, Protein 11g, Vitamin C 33mg 163%, Calcium 341mg 26%, Iron 1mg 4%, Potassium 237mg 5%",7.905990492966246,4.059828941046734,7.748575110992583,6.014110378874236,6.180851767063425
Baked Peaches,"1 (16 ounce) package frozen peach slices, ⅓ cup brown sugar substitute, ¼ cup pecans, 1 tablespoon all-purpose flour, 1 teaspoon vanilla extract",https://www.allrecipes.com/recipe/241987/baked-peaches/,"Total Fat 3g 4%, Saturated Fat 0g 2%, Sodium 11mg 0%, Total Carbohydrate 21g 8%, Dietary Fiber 2g 6%, Total Sugars 18g, Protein 1g, Vitamin C 71mg 357%, Calcium 16mg 1%, Iron 1mg 3%, Potassium 120mg 3%",3.610364764756927,5.544939117301153,5.900306183524765,1.0,2.9314980766617094
